Kategori,Urun Adi,Marka,Fiyat (TL),Puan,Yorum Sayisi,Link
Gunes Bakim,Avene Cleanance SPF 50+ Yağlı ve Akneye Eğilimli Ciltler için Yüksek Korumalı Güneş Kremi 50 ml,Avene,731.0,4.5,924,https://www.hepsiburada.com/avene-cleanance-solaire-spf-50-yagli-ve-akneli-ciltler-icin-gunes-koruma-kremi-50-ml-pm-HB00000683XE
Gunes Bakim,"Axis-y AXIS-Y Complete No-Stress Physical Sunscreen (V3) 50 ml, Sivilce Karşıtı Fiziksel Yüz Güneş Kremi",Axis-y,855.0,4.8,35,https://www.hepsiburada.com/axis-y-complete-no-stress-physical-sunscreen-50-ml-pm-HBC00000TNMTC
Gunes Bakim,Kiko Milano KikoMilano Kiko Bronzer - Green Me Bronzer - 102,Kiko,999.0,4.7,66,https://www.hepsiburada.com/kikomilano-kiko-bronzer-green-me-bronzer-102-pm-HBC00002FW5PC
Gunes Bakim,MISSHA Aydınlatıcı ve Nemlendirici Güneş Kremi All Around Safe Block Essence Sun EX SPF45/PA+++ 50ml,MISSHA,694.9,4.6,328,https://www.hepsiburada.com/missha-nemlendirici-gunes-kremi-50ml-ex-spf45-pa-pm-HB00000GZK6Z
Gunes Bakim,Solante Tele-Rubor SPF 50+ Hassas Ciltler İçin Güneş Koruyucu Losyon 150 ml Renksiz Özellik,Solante,1299.9,4.6,227,https://www.hepsiburada.com/solante-tele-rubor-spf-50-gunes-koruyucu-losyon-150-ml-pm-HBC00000B8SHH
Gunes Bakim,"La Roche-Posay Anthelios Uvmune 400 Spf 50+ Güneş Koruyucu- Kuru, Kızarık ve Hassas Ciltler İçin Yüz Kremi 50 ML",La,975.0,4.6,2644,https://www.hepsiburada.com/anthelios-uvmune-400-spf-50-gunes-koruyucu-kuru-kizarik-ve-hassas-ciltler-icin-yuz-kremi-50-ml-pm-HBC00001OGWXB
Gunes Bakim,"Bioderma Photoderm Spot Age SPF50+ Leke, Yaşlanma ve Kırışıklık Karşıtı Yüksek Korumalı Güneş Kremi 40 ml",Bioderma,1198.0,4.4,312,https://www.hepsiburada.com/photoderm-spot-age-spf50-leke-yaslanma-ve-kirisiklik-karsiti-yuksek-korumali-gunes-kremi-40-ml-pm-HB00000SEQFX
Gunes Bakim,"Clinique Superdefense™ City Block SPF 50 Günlük Güneş Koruyucu Krem 40ml	 | UVA/UVB koruma, Tere Dayanıklı",Clinique,2195.0,4.7,96,https://www.hepsiburada.com/clinique-superdefense-city-block-spf-50-gunes-koruyucu-40-ml-pm-HBC000022IZ12
Gunes Bakim,Dermoskin AcnMat Face Protection Gel Güneş Kremi Spf 50+ | Akne Karşıtı | UVA&UVB Koruyucu | 50 ml,Dermoskin,509.0,4.4,806,https://www.hepsiburada.com/dermoskin-acnmat-face-protection-gel-gunes-kremi-spf-50-akne-karsiti-uva-uvb-koruyucu-50-ml-pm-sgleo19046
Gunes Bakim,"Nivea SPF50 Derma Skin Clear Yüz Kremi 40 Ml, Matlaştırıcı, Karnitin, Gliserin,niasinamid",Nivea,289.0,5.0,4,https://www.hepsiburada.com/spf50-derma-skin-clear-yuz-kremi-40-ml-matlastirici-karnitin-gliserin-niasinamid-pm-HBC00009I41A5
Gunes Bakim,Harrem Nemlendirici Leke Karşıtı SPF50+ Güneş Kremi 50 ml,Harrem,466.0,4.3,10,https://www.hepsiburada.com/harrem-nemlendirici-leke-karsiti-spf50-gunes-kremi-50-ml-pm-HBC00006NGNMR
Parfum,Bargello 228 Kadın 50 ml Parfüm Edp Orıental,Bargello,500.0,4.5,2575,https://www.hepsiburada.com/bargello-228-kadin-50-ml-parfum-edp-oriental-pm-HBC00001C9XU0
Parfum,Bargello 567 Erkek 50 ml Parfüm Edp Fresh,Bargello,500.0,4.3,1572,https://www.hepsiburada.com/bargello-509-erkek-50-ml-parfum-edp-fresh-pm-HBC00004ADQPC
Parfum,Bargello 709 50 ml Erkek Parfüm EDP Odunsu Koku ile Modern Hediye Seçeneği,Bargello,500.0,4.4,3584,https://www.hepsiburada.com/bargello-505-erkek-50-ml-parfum-edp-oriantal-pm-HBC00004ADQM5
Parfum,Bargello Kadın Parfüm 122 Oriental 50 ml EDP Odunsu Koku Günlük Kullanıma Uygun,Bargello,500.0,4.5,7239,https://www.hepsiburada.com/bargello-kadin-kadin-parfum-122-oriental-50-ml-edp-pm-HB00000ONJ6Z
Parfum,Bargello BARGELLO 561 FRESH Erkek Parfüm 50 ml EDP Meyveli Koku ile Ferahlatıcı Etki,Bargello,500.0,4.4,5915,https://www.hepsiburada.com/bargello-erkek-parfum-561-fresh-50-ml-edp-pm-HB00000N6KGF
Parfum,Mad Parfüm Mad V112 Selective 50 ml Kadın Parfüm,Mad,529.99,4.4,158,https://www.hepsiburada.com/mad-parfum-mad-v112-selective-50-ml-kadin-parfum-pm-HBC0000513B6Q
Parfum,Bargello 384 Kadın 50 ml Floral EDP Parfüm Çiçeksi Koku ile Kendinizi İfade Edin,Bargello,500.0,4.5,2372,https://www.hepsiburada.com/bargello-100-kadin-50-ml-parfum-edp-floral-pm-HBC00004ADQRY
Parfum,"Ashley Joy Love Kadın Parfüm EDP  50 ML | Oryantal & Çiçeksi  | Zencefil, Kan Portakalı, Sandal Ağacı, Paçuli | Amber Renkli Cam Şişe",Ashley,1749.9,3.7,3,https://www.hepsiburada.com/ashley-joy-love-kadin-edp-parfum-50-ml-aromatik-koku-ile-turkiye-menseli-pm-HBC0000AF2VHJ
Parfum,Mad Parfüm Mad P102 Selective 100 ml Erkek Parfüm,Mad,779.99,4.4,490,https://www.hepsiburada.com/mad-parfum-mad-p102-selective-100-ml-erkek-parfum-pm-HBC00003N5WYJ
Parfum,"Slazenger Erkek Parfüm ve Deodorant Seti - Ferah Narenciye ve Okyanus Esintisi, 125 ml + 150 ml, Yeni Baba İçin Mükemmel Hediye",Slazenger,524.0,4.6,4038,https://www.hepsiburada.com/slazenger-erkek-parfum-ve-deodorant-seti-ferah-narenciye-ve-okyanus-esintisi-125-ml-150-ml-yeni-baba-icin-mukemmel-hediye-pm-sgei19638
Parfum,Mad Parfüm Mad P102 Selective 50 ml Erkek Parfüm,Mad,529.99,4.5,244,https://www.hepsiburada.com/mad-parfum-mad-p102-selective-50-ml-erkek-parfum-pm-HBC00003N5WEV
Parfum,Mad Parfüm Mad A118 Selective 50 ml Kadın Parfüm,Mad,529.99,4.3,338,https://www.hepsiburada.com/mad-parfum-a118-selective-50-ml-kadin-parfum-pm-HBC00003L2AVY
Parfum,Mad Parfüm Mad H105 Selective 50 ml Kadın Parfüm,Mad,529.99,4.3,445,https://www.hepsiburada.com/mad-parfum-parfum-mad-h105-selective-50-ml-kadin-parfum-pm-HBC00003L2AUQ
Parfum,"Imprime Mer EDP Erkek Parfüm 100ml | Marin ve Fresh | Deniz, Bergamot, Nilüfer, Paçuli, Sandal Ağacı",Imprime,1199.0,4.1,1164,https://www.hepsiburada.com/imprime-mer-edp-100-ml-erkek-parfumu-pm-HBC00002R1X3K
Parfum,"Imprime Muse EDP Kadın Parfüm 50ml | Çiçeksi ve Meyveli | Frenk Üzümü, Lavanta, Yasemin, Vanilya, Misk, Amber",Imprime,1099.0,4.3,944,https://www.hepsiburada.com/imprime-muse-edp-50-ml-kadin-parfumu-pm-HBC00002R1X3U
Parfum,Mad Parfüm Mad A114 Selective 100 ml Erkek Parfüm,Mad,779.99,4.4,356,https://www.hepsiburada.com/mad-parfum-mad-a114-selective-100-ml-erkek-parfum-pm-HBC00003N5X2J
Parfum,Mad Parfüm Mad Z101 Selective 50 ml Kadın Parfüm,Mad,529.99,4.2,260,https://www.hepsiburada.com/mad-parfum-mad-z101-selective-50-ml-kadin-parfum-pm-HBC00003L2APW
Parfum,Mad Parfüm Mad V112 Selective 100 ml Kadın Parfüm,Mad,779.99,4.3,97,https://www.hepsiburada.com/mad-parfum-mad-v112-selective-100-ml-kadin-parfum-pm-HBC0000513B6U
Parfum,Mad Parfüm Mad A114 Selective 50 ml Erkek Parfüm,Mad,529.99,4.5,219,https://www.hepsiburada.com/mad-parfum-mad-a114-selective-50-ml-erkek-parfum-pm-HBC00003N5WWR
Parfum,Mad Parfüm Mad V109 Selective 50 ml Kadın Parfüm,Mad,529.99,4.6,108,https://www.hepsiburada.com/mad-parfum-mad-v109-selective-50-ml-kadin-parfum-pm-HBC000043LK13
Parfum,Bargello 444 KADIN 50 ml PARFÜM EDP ORIENTAL,Bargello,500.0,4.5,174,https://www.hepsiburada.com/bargello-444-kadin-50-ml-parfum-edp-oriental-pm-HBC00006V3OZ2
Parfum,Avon Perceive EDT 100 ml Erkek Parfüm,Avon,669.9,4.3,5086,https://www.hepsiburada.com/avon-perceive-edt-100-ml-erkek-parfum-pm-sgavonzf008g
Parfum,Mad Parfüm Mad W213 Selective 50 ml Kadın Parfüm,Mad,529.99,4.4,158,https://www.hepsiburada.com/mad-parfum-mad-w213-selective-50-ml-kadin-parfum-pm-HBC00003L2AL9
Parfum,TDRS Narcotic 100 ML Bergamot Özel Seri Uzun Süre Kalıcı Erkek Parfüm,TDRS,799.97,4.1,292,https://www.hepsiburada.com/narcotic-100-ml-bergamot-ozel-seri-uzun-sure-kalici-erkek-parfum-pm-HBC000064TGQ2
Parfum,Bargello 575 EDP 50 ml Erkek Parfüm Odunsu Koku ile Gün Boyu Ferahlık Sağlar,Bargello,500.0,4.5,610,https://www.hepsiburada.com/bargello-575-erkek-50-ml-parfum-edp-woody-pm-HBC000015QEV5
Parfum,Lancome Idôle EDP 25 ml Hediyelik Seti Lüks Ambalaj ile Kadınlar İçin Özel Tasarım Parfüm,Lancome,4200.0,4.4,18,https://www.hepsiburada.com/lancome-id-le-edp-25-ml-hediyelik-seti-luks-ambalaj-ile-kadinlar-icin-ozel-tasarim-parfum-pm-HBC0000AIJDUA
Parfum,Bargello 134 Kadın 50 ml Parfüm Edp oriantal,Bargello,500.0,4.5,942,https://www.hepsiburada.com/bargello-102-kadin-50-ml-parfum-edp-oriantal-pm-HBC00004ADQKM
Parfum,Mad Parfüm Mad B103 Selective 50 ml Kadın Parfüm,Mad,529.99,4.5,139,https://www.hepsiburada.com/mad-parfum-mad-b103-selective-50-ml-kadin-parfum-pm-HBC00003L2AVQ
Parfum,"Imprime Cherié EDP Kadın Parfüm 50ml | Çiçeksi ve Fresh | Çilek, Ananas, Şakayık, Müge, Yasemin, Amber",Imprime,1099.0,4.2,428,https://www.hepsiburada.com/imprime-cheri-edp-50-ml-kadin-parfumu-pm-HBC00002R6QAR
Parfum,Mad Parfüm Mad A115 Selective 100 ml Erkek Parfüm,Mad,779.99,4.3,279,https://www.hepsiburada.com/mad-parfum-mad-a115-selective-100-ml-erkek-parfum-pm-HBC00003N5X2H
Parfum,Bargello 685 EDP Fresh 50 ml Erkek Parfüm Odunsu Koku ile Ferah Bir Deneyim Sunar,Bargello,500.0,4.3,1047,https://www.hepsiburada.com/bargello-509-erkek-50-ml-parfum-edp-fresh-pm-HBC00004ADQPT
Parfum,Mad Parfüm Mad P107 Selective 50 ml Kadın Parfüm,Mad,529.99,4.4,105,https://www.hepsiburada.com/mad-parfum-mad-p107-selective-50-ml-kadin-parfum-pm-HBC000043LK0Z
Parfum,Mad Parfüm Mad V102 Selective 50 ml Kadın Parfüm,Mad,529.99,4.5,83,https://www.hepsiburada.com/mad-parfum-mad-v102-selective-50-ml-kadin-parfum-pm-HBC00003L2AU4
Parfum,Bargello 585 50 ml Erkek Parfüm EDP Floral Odunsu Koku ile Hediye İçin Uygun,Bargello,500.0,4.4,508,https://www.hepsiburada.com/bargello-525-erkek-50-ml-parfum-edp-floral-pm-HBC00004ADQSB
Parfum,Slazenger Erkek Parfüm ve Deodorant Seti - Gold EDT Ferah ve Spor Koku (125 ml + 150 ml) Hediye Kutusu,Slazenger,630.0,4.6,1906,https://www.hepsiburada.com/slazenger-erkek-parfum-ve-deodorant-seti-gold-edt-ferah-ve-spor-koku-125-ml-150-ml-hediye-kutusu-pm-HB0000135J1H
Parfum,Avon AVON Wish Of Love Kadın Parfüm Edt 50 Ml.,Avon,234.9,4.5,8007,https://www.hepsiburada.com/avon-wish-of-love-kadin-parfum-edt-50-ml-pm-sgavonparfum0305
Parfum,Victoria's Secret Vıctorıa's Secret Bare Vanilla-Midnight Bloom-Aqua Kiss Vücut Spreyi Üçlü Set,Victoria's,649.0,4.4,81,https://www.hepsiburada.com/victoria-s-secret-bare-vanilla-midnight-bloom-aqua-kiss-vucut-spreyi-uclu-set-pm-HBC000063KPCQ
Parfum,Mad Parfüm Mad G103 Selective 50 ml Kadın Parfüm,Mad,529.99,4.4,175,https://www.hepsiburada.com/mad-parfum-mad-g103-selective-50-ml-kadin-parfum-pm-HBC00003L2AV0
Parfum,Avon Musk Marine EDT 75 Ml Erkek Parfüm Ferah Koku ile Gün Boyu Tazelik,Avon,259.0,4.2,1383,https://www.hepsiburada.com/avon-musk-marine-edt-75-ml-erkek-parfum-pm-sgavonzf44906
Parfum,Mad Parfüm Mad H103 Selective 50 ml Kadın Parfüm,Mad,529.99,4.3,112,https://www.hepsiburada.com/mad-parfum-mad-h103-selective-50-ml-kadin-parfum-pm-HBC00003L2AUS
Parfum,Bade Natural One&Only Kadın/Erkek Parfüm Seti 50MLX2 EDT,Bade,449.9,4.5,24,https://www.hepsiburada.com/bade-natural-one-only-kadin-erkek-parfum-seti-50ml-x2-edt-pm-HBC0000CHYXJX
Parfum,Slazenger Active Sport Erkek  Mavi Parfüm,Slazenger,442.94,4.5,1579,https://www.hepsiburada.com/slazenger-active-sport-mavi-edt-125-ml-erkek-parfumu-pm-sgslazenger1006
Parfum,Bargello 272 Kadın parfüm 50 ml edp,Bargello,500.0,4.4,84,https://www.hepsiburada.com/bargello-272-kadin-parfum-50-ml-edp-pm-HBC00007VCIOG
Parfum,Mad Parfüm Mad N101 Selective 50 ml Kadın Parfüm,Mad,529.99,4.2,140,https://www.hepsiburada.com/mad-parfum-mad-n101-selective-50-ml-kadin-parfum-pm-HBC00003L2AUA
Parfum,Mad Parfüm Mad A115 Selective 50 ml Erkek Parfüm Oryantal Koku Aromatik Özellikleriyle Özel,Mad,529.99,4.6,195,https://www.hepsiburada.com/mad-parfum-mad-a115-selective-50-ml-erkek-parfum-pm-HBC00003N5WWP
Parfum,Mad Parfüm Mad A118 Selective 100 ml Kadın Parfüm,Mad,779.99,4.4,110,https://www.hepsiburada.com/mad-parfum-mad-a118-selective-100-ml-kadin-parfum-pm-HBC00003N5X77
Parfum,Mad Parfüm Mad W139 Selective 100 ml Erkek Parfüm,Mad,779.99,4.3,60,https://www.hepsiburada.com/mad-parfum-mad-w139-selective-100-ml-erkek-parfum-pm-HBC00003N5WXN
Parfum,Bargello 324 Kadın 50 ml Parfüm Edp oriantal,Bargello,500.0,4.5,649,https://www.hepsiburada.com/bargello-102-kadin-50-ml-parfum-edp-oriantal-pm-HBC00004ADQL8
Parfum,Avon AVON Wish Of Love Kadın Parfüm Edt 50 Ml. Üçlü Set,Avon,514.9,4.6,2348,https://www.hepsiburada.com/avon-wish-of-love-kadin-parfum-edt-50-ml-uclu-set-pm-sgavonzf190g
Parfum,Avon Incandessence EDP 50 ml Kadın Parfüm,Avon,523.9,4.5,3329,https://www.hepsiburada.com/avon-incandessence-edp-50-ml-kadin-parfum-pm-sgavonparfum0014
Parfum,First Class Erkek EDT Parfüm 100 Ml Hediyelik Tipi Erkek İçin Lüks ve Şık Tasarım,First,599.95,4.5,1183,https://www.hepsiburada.com/first-class-erkek-parfum-edt-100-ml-pm-sgdil502412
Parfum,Mad Parfüm Mad B107 Selective 50 ml Kadın Parfüm,Mad,529.99,4.3,50,https://www.hepsiburada.com/mad-parfum-mad-b107-selective-50-ml-kadin-parfum-pm-HBC00005TH0IA
Parfum,Mad Parfüm Mad P103 Selective 100 ml Erkek Parfüm,Mad,779.99,4.7,19,https://www.hepsiburada.com/mad-parfum-mad-p103-selective-100-ml-erkek-parfum-pm-HBC00003N5WYH
Parfum,"Imprime Antique EDP Erkek Parfüm 100ml | Odunsu ve Çiçeksi | Iris, Vetiver, Vanilya, Sedir Ağacı",Imprime,1199.0,4.0,1299,https://www.hepsiburada.com/imprime-antique-edp-100-ml-erkek-parfumu-pm-HBC00002R1X3O
Parfum,Bargello 171 Kadın 50 ml Parfüm Edp Floral,Bargello,500.0,4.5,602,https://www.hepsiburada.com/bargello-100-kadin-50-ml-parfum-edp-floral-pm-HBC00004ADQQV
Parfum,Bargello Only One Erkek 50 ml Parfüm Edp,Bargello,500.0,4.2,447,https://www.hepsiburada.com/bargello-only-one-erkek-50-ml-parfum-edp-pm-HBC00006LBXMK
Parfum,Avon Rare Pearls Kadın Parfüm EDP 50 ml Üçlü Set Cazibe ve Gizemle Dolu Hediyelik,Avon,1135.0,4.8,231,https://www.hepsiburada.com/avon-rare-pearls-kadin-parfum-edp-50-ml-uclu-set-pm-HB00000TKNJT
Parfum,Mad Parfüm Mad Y101 Selective 50 ml Kadın Parfüm,Mad,529.99,4.5,153,https://www.hepsiburada.com/mad-parfum-mad-y101-selective-50-ml-kadin-parfum-pm-HBC00003L29QN
Parfum,Avon AVON Incandessence Kadın Parfüm Edp 50 Ml. Üçlü Set,Avon,1183.0,4.7,297,https://www.hepsiburada.com/avon-incandessence-kadin-parfum-edp-50-ml-uclu-set-pm-sgavonzf179g
Parfum,Mad Parfüm W152 Selective 100 Ml Kadın Parfüm,Mad,779.99,4.4,24,https://www.hepsiburada.com/mad-parfum-w152-selective-100-ml-kadin-parfum-pm-HBC00006SHUMD
Parfum,Mad Parfüm Mad W180 Erkek Parfüm 100 ml Odunsu Koku ile Ferahlatıcı ve Kalıcı Etki,Mad,779.99,4.4,201,https://www.hepsiburada.com/mad-parfum-mad-w180-selective-100-ml-erkek-parfum-pm-HBC00003N5WXB
Parfum,Mad Parfüm Mad Y102 Selective 50 ml Kadın Parfüm,Mad,529.99,4.5,164,https://www.hepsiburada.com/mad-parfum-mad-y102-selective-50-ml-kadin-parfum-pm-HBC00003L2APY
Parfum,Mad Parfüm Mad W201 Selective 50 ml Kadın Parfüm,Mad,529.99,4.5,99,https://www.hepsiburada.com/mad-parfum-mad-w201-selective-50-ml-kadin-parfum-pm-HBC00003L2ALJ
Parfum,Bargello 509 Erkek 50 ml Parfüm Edp Fresh,Bargello,500.0,4.4,316,https://www.hepsiburada.com/bargello-509-erkek-50-ml-parfum-edp-fresh-pm-HBC00004ADQM8
Parfum,Avon Erkekler İçin Avon Full Speed 75 ml EDT Parfüm Odunsu Meyvemsi Turunçgil Koku ile Hız Tutkusu,Avon,521.0,4.5,2628,https://www.hepsiburada.com/avon-full-speed-75-ml-erkek-parfum-pm-sgavonparfum1006
Parfum,TDRS Dark Royal Ozonik Özel Seri Uzun Süre Kalıcı 100 ML EDP Erkek Parfüm,TDRS,799.97,4.0,95,https://www.hepsiburada.com/dark-royal-ozonik-ozel-seri-uzun-sure-kalici-100-ml-edp-erkek-parfum-pm-HBC00008NX6OU
Parfum,Mad Parfüm Mad D121 Selective 50 ml Kadın Parfüm,Mad,529.99,4.7,13,https://www.hepsiburada.com/mad-parfum-mad-d121-selective-50-ml-kadin-parfum-pm-HBC00003L2AV8
Parfum,Mad Parfüm Mad L101  50 ml Kadın Parfüm Parfüm,Mad,529.99,4.3,59,https://www.hepsiburada.com/mad-parfum-l101-klasik-50-ml-kadin-parfum-parfum-pm-HB00001A4D8W
Parfum,Mad Parfüm Mad W150 Selective 50 ml Kadın Parfüm,Mad,529.99,4.2,78,https://www.hepsiburada.com/mad-parfum-mad-w150-selective-50-ml-kadin-parfum-pm-HBC00003L2ATU
Parfum,Avon Individual Blue 100 ml EDT Erkek Parfüm Çekici Koku ile Dinamik Etki,Avon,369.9,4.2,943,https://www.hepsiburada.com/individual-blue-for-him-edt-100ml-pm-HB000000IIGG
Parfum,Avon Wish Of Love Kadın EDT 50 ml Meyvemsi Çiçeksi Koku 2'li Parfüm Seti,Avon,382.9,4.6,2886,https://www.hepsiburada.com/avon-wish-of-love-edt-50-ml-kadin-2-li-parfum-set-pm-sgavonzf359
Parfum,Mad Parfüm Mad V109 Selective 100 ml Kadın Parfüm,Mad,779.99,4.5,57,https://www.hepsiburada.com/mad-parfum-mad-v109-selective-100-ml-kadin-parfum-pm-HBC0000513B6K
Sac Bakim,Urban Care Rosemary & Clove Biberiye ve Karanfil Suyu % 99.5 Doğal ve Saf 150 ml,Urban,253.11,4.4,582,https://www.hepsiburada.com/urban-care-rosemary-clove-biberiye-ve-karanfil-suyu-99-5-dogal-ve-saf-150-ml-pm-HBC00006ROFUZ
Sac Bakim,Vichy Dercos Kepek Karşıtı Şampuan 390 ml Normal/Yağlı Saçlar İçin Temizleyici Etki,Vichy,1382.27,4.6,11531,https://www.hepsiburada.com/vichy-dercos-sampuan-kepek-normal-ve-yagli-saclar-390-ml-pm-sgdrmkd41007
Sac Bakim,Bade Natural Biberiye Suyu Dökülme Karşıtı ve Saç Uzamasını Destekleyici Saç Toniği %100 Doğal ve Saf 100 ml,Bade,379.9,4.4,3159,https://www.hepsiburada.com/bade-natural-biberiye-suyu-guclendirici-sac-tonigi-100-dogal-ve-saf-100-ml-pm-HBC00005SZ07Q
Sac Bakim,Bioxcin Forte Şampuan Tüm Saç Tipleri İçin 3x300ml - Yoğun Dökülme Şampuanı Avantajlı Paket,Bioxcin,428.0,4.6,12050,https://www.hepsiburada.com/bioxcin-forte-sampuan-tum-sac-tipleri-icin-3x300ml-yogun-dokulme-sampuani-avantajli-paket-pm-HB00000OW3D1
Sac Bakim,Powertec TR-901 Turbo Professional Series Fön Makinesi & Saç Kurutma 2500w Performans,Powertec,1225.0,4.6,49838,https://www.hepsiburada.com/powertec-tr-901-turbo-professional-series-fon-makinesi-sac-kurutma-2500w-performans-pm-HB000002J8XS
Sac Bakim,Vichy Dercos Energy+ Dökülme Karşıtı Şampuan 400 ml K5122,Vichy,1466.87,4.3,3849,https://www.hepsiburada.com/vichy-dercos-energy-sampuan-400-ml-tum-sac-tipleri-icin-pm-sgdrmkd41001
Sac Bakim,Head&Shoulders H&S Men Ultra Old Spice Kepek Karşıtı Şampuan 300 ml+OS Captain Erkek Deodorant Stick 50 ml,Head&Shoulders,299.9,4.8,49,https://www.hepsiburada.com/h-s-men-ultra-old-spice-kepek-karsiti-sampuan-300-ml-os-captain-erkek-deodorant-stick-50-ml-pm-HBC00009JM1R0
Sac Bakim,Urban Care Brazilian Keratin Saç Bakım Şampuanı 350 ml,Urban,99.9,4.2,71,https://www.hepsiburada.com/urban-care-brazilian-keratin-sac-bakim-sampuani-350-ml-pm-HBC00007L5D2P
Sac Bakim,Urban Care Expert Series Biotin & Caffeine Dökülme Karşıtı Saç Bakım Şampuanı 350 ml,Urban,180.59,4.4,4728,https://www.hepsiburada.com/urban-care-expert-biotin-ve-kafein-sac-bakim-sampuani-hizli-uzamaya-350-ml-pm-HB000009GEL4
Sac Bakim,Siveno %100 Doğal Biberiye Suyu Saç Dökülmesi Karşıtı ve Hızlı Saç Uzatma Etkili Saç Toniği 150 ml,Siveno,533.11,4.4,921,https://www.hepsiburada.com/siveno-100-dog-al-biberiye-suyu-sac-do-ku-lmesi-kars-iti-ve-hizli-sac-uzatma-etkili-sac-tonig-i-150-ml-pm-HBC000088TTFN
Sac Bakim,Elidor Superblend Saç Bakım Şampuanı Güçlü ve Parlak E Vitamini Makademya Yağı  650 ml,Elidor,149.9,4.7,5464,https://www.hepsiburada.com/elidor-superblend-sac-bakim-sampuani-guclu-ve-parlak-e-vitamini-makademya-yagi-650-ml-pm-sguni20035943
Sac Bakim,Urban Care Brazilian Keratin Yoğun Saç Bakım Maskesi 230 ml,Urban,119.9,4.6,73,https://www.hepsiburada.com/urban-care-brazilian-keratin-yogun-sac-bakim-maskesi-230-ml-pm-HBC00007LOOKP
Sac Bakim,Head&Shoulders Head & Shoulders Clinical Strength Dry Scalp Rescue Kuru Saç Derisine Özel Şampuan 400 ml,Head&Shoulders,390.0,4.5,10280,https://www.hepsiburada.com/head-shoulders-clinical-strength-dry-scalp-rescue-kuru-sac-derisine-ozel-sampuan-400-ml-pm-sgaymis000274018
Sac Bakim,Urban Care Brazilian Keratin Yoğun Saç Bakım Serumu 75 ml,Urban,119.9,4.7,59,https://www.hepsiburada.com/urban-care-brazilian-keratin-yogun-sac-bakim-serumu-75-ml-pm-HBC00007L5C3S
Sac Bakim,Urban Care Brazilian Keratin Saç Bakım Kremi Kuru ve Mat Saçlar İçin 200 ML Vegan Formül,Urban,99.9,4.5,49,https://www.hepsiburada.com/urban-care-brazilian-keratin-sac-bakim-kremi-kuru-ve-mat-saclar-icin-200-ml-vegan-formul-pm-HBC00007L5CE2
Sac Bakim,Pantene Dökülme Karsıtı 3'ü 1 Arada Şampuan 400Ml,Pantene,99.9,4.7,994,https://www.hepsiburada.com/pantene-dokulme-karsiti-3-u-1-arada-sampuan-400ml-pm-HBC00002UKYC5
Sac Bakim,Agarta Doğal Şaç Dökülmesine Karşı Şampuan 400 ml,Agarta,225.0,4.4,1061,https://www.hepsiburada.com/agarta-dogal-sampuan-sac-dokulmesine-karsi-cozum-400-ml-pm-HB000005HGLT
Sac Bakim,Urban Care No.2 Bond Plex Restore Repair Yıpranma Karşıtı Saç Bakım Şampuanı 350 ml - Sülfatsız,Urban,109.9,4.2,480,https://www.hepsiburada.com/urban-care-no-2-bond-plex-restore-repair-yipranma-karsiti-sac-bakim-sampuani-350-ml-sulfatsiz-pm-HBC000041J76V
Sac Bakim,Urban Care URBAN Care Pink Allure Saç Bakım Parfümü 50 ml,Urban,119.9,4.0,136,https://www.hepsiburada.com/urban-care-pink-allure-sac-bakim-parfumu-50-ml-pm-HBC0000744J75
Sac Bakim,Yurish Mucizevi 3'lü Tarak Seti Saç Şekillendirme Tüm Saçlar Için,Yurish,149.99,4.0,122,https://www.hepsiburada.com/mucizevi-3-lu-tarak-seti-sac-sekillendirme-tum-saclar-icin-pm-HBC0000C8AVS8
Sac Bakim,"Ashley Joy Ultra Parlaklık, Elektriklenme Karşıtı, Isı ve Neme Karşı Glow Etkili Koruyucu Saç  Spreyi 150 ml",Ashley,899.9,4.9,11,https://www.hepsiburada.com/ultra-parlaklik-elektriklenme-karsiti-isi-ve-neme-karsi-koruyucu-sac-spreyi-150-ml-pm-HBC0000CM0GRT
Sac Bakim,Vichy Dercos Şampuan Kuru ve Kepekli 390 ml K9623,Vichy,1457.04,4.6,4918,https://www.hepsiburada.com/vichy-dercos-kepege-karsi-etkili-sac-bakim-sampuani-kuru-saclar-390-ml-pm-sgucuzcmprtx59
Sac Bakim,Pantene Kepek Karsıtı 3'ü 1 Arada Şampuan 400Ml,Pantene,99.9,4.7,790,https://www.hepsiburada.com/pantene-kepek-karsiti-3-u-1-arada-sampuan-400ml-pm-HBC00002UL6RJ
Sac Bakim,Hc Care HC Care Complex Bitkisel Saç Bakım Kompleksi - 100 ml,Hc,712.0,4.7,15404,https://www.hepsiburada.com/complex-bitkisel-sac-bakim-kompleksi-100-ml-pm-HBC00002VUV0W
Sac Bakim,Urban Care No.6 Bond Plex Restore Repair Yıpranma Karşıtı Serum Saç Bakım Yağı 100 ml - Vegan,Urban,217.38,4.4,1790,https://www.hepsiburada.com/urban-care-no-6-bond-plex-restore-repair-yipranma-karsiti-serum-sac-bakim-yagi-100-ml-vegan-pm-HBC000041J7H1
Sac Bakim,Clear Men Şampuan 350 Ml Legend By Cr7 Ronaldo,Clear,139.9,4.7,4965,https://www.hepsiburada.com/clear-men-kepege-karsi-etkili-sampuan-legend-by-cr7-350-ml-pm-HBC0000108KNC
Sac Bakim,Clear Men Kepeğe Karşı Etkili Şampuan Cool Sport Menthol Ferahlatıcı Mentol Etkisi 600 ml,Clear,209.9,4.7,3801,https://www.hepsiburada.com/clear-men-kepege-karsi-etkili-sampuan-cool-sport-menthol-ferahlatici-mentol-etkisi-600-ml-pm-HBC00003RSHQA
Sac Bakim,Clear Men Kepeğe Karşı Etkili Şampuan Saç Dökülmesine Karşı 350 ml,Clear,119.9,4.6,2210,https://www.hepsiburada.com/clear-men-kepege-karsi-etkili-sampuan-sac-dokulmesine-karsi-350-ml-pm-HBC0000108KN6
Sac Bakim,"Philips 3000 Serisi Saç Düzleştirici, Keratin Katkılı, ThermoProtect Teknolojisi, BHS375/00",Philips,2743.02,4.6,542,https://www.hepsiburada.com/philips-3000-serisi-sac-duzlestirici-keratin-katkili-thermoprotect-teknolojisi-bhs375-00-pm-HB00000IGHR5
Sac Bakim,Elidor Superblend Saç Bakım Şampuanı Anında Onarıcı Bakım Vitamin C Ceramides Keratin 650 ml,Elidor,149.9,4.6,5017,https://www.hepsiburada.com/elidor-superblend-sac-bakim-sampuani-aninda-onarici-bakim-vitamin-c-ceramides-keratin-650-ml-pm-sguni20256890
Sac Bakim,Urban Care Sülfatsız Saç Bakım Kremi 200 ml Bitkisel Keratin Sarı Gri Açık Kumral Saçlara Turunculaşma Önleyici,Urban,99.9,4.5,105,https://www.hepsiburada.com/urban-care-sulfatsiz-sac-bakim-kremi-200-ml-bitkisel-keratin-sari-gri-acik-kumral-saclara-turunculasma-onleyici-pm-HBC00000N50I5
Sac Bakim,Urban Care Rosemary & Clove Biberiye ve Karanfil Saç Bakım Yağı % 99.5 Doğal ve Saf 100 ml,Urban,109.9,4.4,224,https://www.hepsiburada.com/urban-care-rosemary-clove-biberiye-ve-karanfil-sac-bakim-yagi-99-5-dogal-ve-saf-100-ml-pm-HBC00006ROFTO
Sac Bakim,Urban Care Intense Keratin Saç Bakım Şampuan 350 ml,Urban,131.02,4.2,173,https://www.hepsiburada.com/urban-care-intense-keratin-sac-bakim-sampuan-350-ml-pm-HBC000089X3H6
Sac Bakim,Bade Natural Papatya Suyu Saç Toniği %100 Doğal ve Saf 100 ml,Bade,379.9,4.5,442,https://www.hepsiburada.com/bade-natural-dogal-papatya-suyu-100-ml-pm-HBC00008RU4ZC
Sac Bakim,Urban Care Expert Series Biotin Caffeine Saç Bakım Toniği 200 ml - Şampuan 100 ml,Urban,179.9,4.6,40,https://www.hepsiburada.com/urban-care-expert-series-biotin-caffeine-sac-bakim-tonigi-200-ml-sampuan-100-ml-pm-HBC00008JJ3C2
Sac Bakim,Head&Shoulders Klasik Bakım Şampuanı 800 ml Tüm Saç Tipleri için Kepeğe Karşı Etkili,Head&Shoulders,299.9,4.7,657,https://www.hepsiburada.com/head-shoulders-klasik-bakim-sampuani-800-ml-tum-sac-tipleri-icin-kepege-karsi-etkili-pm-HBC00007OIZIU
Sac Bakim,Gliss Schwarzkopf Gliss Serum Deep Repair Onarıcı Şampuan 400 Ml,Gliss,107.9,4.7,826,https://www.hepsiburada.com/schwarzkopf-gliss-serum-deep-repair-onarici-sampuan-400-ml-pm-HB00000ZQMVT
Sac Bakim,Baby Me Kolay Tarama Spreyi Provitamin B5 ve Hindistan Cevizi Yağı İçeren 200 ml Beyaz Renk,Baby,78.39,4.2,872,https://www.hepsiburada.com/baby-me-kolay-tarama-spreyi-provitamin-b5-ve-hindistan-cevizi-yagi-iceren-200-ml-beyaz-renk-pm-HBC000011KRHW
Sac Bakim,Elidor Superblend Şampuan ve Bakım Kremi Kepeğe Karşı Etkili 2'si 1 Arada B3 Vitamini Çay Ağacı Yağı Aloe Vera 400 ml,Elidor,129.9,4.7,4679,https://www.hepsiburada.com/elidor-superblend-sampuan-ve-bakim-kremi-kepege-karsi-etkili-2-si-1-arada-b3-vitamini-cay-agaci-yagi-aloe-vera-400-ml-pm-HBC000018QHES
Sac Bakim,"Yves Rocher Güçlendirici Prebiyotik Şampuan-Saç Dökülmesine Karşı/Anti-Chute-SLS,SLES içermez,Vegan-300ml",Yves,599.9,4.4,815,https://www.hepsiburada.com/yves-rocher-prebiyotik-sampuan-dokulme-karsiti-guclendirici-etki-sulfatsiz-300-ml-bitkisel-formul-paraben-icermez-pm-HBC000048VIGZ
