Kategori,Urun Adi,Marka,Fiyat (TL),Puan,Yorum Sayisi,Link
Sac Bakim,"Yves Rocher Yatıştırıcı Prebiyotik Şampuan-Kepeğe Karşı/Anti Pelliculaire-SLS,SLES içermez,Tuzsuz,Vegan-300ml",Yves,589.9,4.4,674,https://www.hepsiburada.com/yves-rocher-kepege-karsi-anti-pelliculaire-yatistirici-prebiyotik-sampuan-tuzsuz-vegan-300-ml-pm-HBC0000447SFH
Sac Bakim,Pantene Temel Bakım 3'ü 1 Arada Şampuan 400Ml,Pantene,99.9,4.7,650,https://www.hepsiburada.com/pantene-temel-bakim-3-u-1-arada-sampuan-400ml-pm-HBC00002UKYC1
Sac Bakim,Elseve Mucizevi Yağ 150 ml Saç Güzelleştirici Krem Tüm Saçlar İçin Besleyen Çiçek Özlü,Elseve,291.92,4.6,2134,https://www.hepsiburada.com/elseve-mucizevi-yag-sac-guzellestirici-krem-150-ml-pm-sgguner36349
Sac Bakim,Remington S8540 Keratin Protect Keratin Korumalı Saç Düzleştirici Dijital Ekran,Remington,2498.92,4.7,2929,https://www.hepsiburada.com/remington-s8540-keratin-protect-keratin-korumali-sac-duzlestirici-dijital-ekran-pm-HB00000AWZS2
Sac Bakim,Ollaluna Saç Bakım Şampuanı 400 ml,Ollaluna,1598.0,4.6,3129,https://www.hepsiburada.com/ollaluna-sac-bakim-sampuani-sac-uzatici-ve-onarici-yag-dengesini-korur-400-ml-bitki-ozlu-paraben-icermez-pm-HBC00004JE43T
Sac Bakim,Pantene Onarıcı & Koruyucu 3'ü 1 Arada Şampuan 400Ml,Pantene,99.9,4.7,945,https://www.hepsiburada.com/pantene-onarici-koruyucu-3-u-1-arada-sampuan-400ml-pm-HBC00002UK95O
Sac Bakim,Urban Care URBAN Care Biotin & Kafein Saç Bakımı Kremi 200 ml Vegan Zayıf Saçlar İçin Güçlendirici,Urban,179.9,4.6,1134,https://www.hepsiburada.com/urban-care-biotinkafein-iceren-sackoku-hizli-uzamaya-sac-derisi-bakim-kremi-200-ml-pm-HB00000T4MIZ
Sac Bakim,Urban Care Hyaluronic & Collagen Ekstra Dolgunlaştırıcı Saç Bakım Şampuanı Vegan 350 ml,Urban,189.0,4.3,221,https://www.hepsiburada.com/urban-care-hyaluronic-collagen-ekstra-sac-bakim-sampuan-350-ml-pm-HBC000089X2AU
Sac Bakim,Men Perfect Schwarzkopf Men Perfect Beyazlara Karşı Jel Boya 80 Kahve Siyah,Men,223.9,4.6,830,https://www.hepsiburada.com/schwarzkopf-men-perfect-beyazlara-karsi-jel-boya-80-kahve-siyah-pm-HBC000034BWNU
Sac Bakim,Elidor Superblend Şampuan ve Bakım Kremi Kepeğe Karşı Etkili 2'si 1 Arada B3 Vitamini Çay Ağacı Yağı Aloe Vera 400 ml X3,Elidor,359.9,4.7,218,https://www.hepsiburada.com/elidor-superblend-sampuan-ve-bakim-kremi-kepege-karsi-etkili-2-si-1-arada-b3-vitamini-cay-agaci-yagi-aloe-vera-400-ml-x3-pm-HBC00004CJVCO
Sac Bakim,Urban Care Mor Turunculaşma Karşıtı Yoğun Saç Bakım Maskesi 230 Ml-Vegan,Urban,109.9,4.7,54,https://www.hepsiburada.com/urban-care-mor-turunculasma-karsiti-yogun-sac-bakim-maskesi-230-ml-vegan-pm-HBC000041J7H6
Sac Bakim,Elidor Superblend 2'si 1 Arada Şampuan ve Saç Bakım Kremi Güçlü ve Parlak E Vitamini Makademya Yağı  400 ml,Elidor,109.9,4.7,4201,https://www.hepsiburada.com/elidor-superblend-2-si-1-arada-sampuan-ve-sac-bakim-kremi-guclu-ve-parlak-e-vitamini-makademya-yagi-400-ml-pm-HBC000018QHEO
Sac Bakim,Morfose Ultra Strong Saç Spreyi 400 ml - Güçlü Tutuş,Morfose,164.0,4.7,4582,https://www.hepsiburada.com/morfose-ultra-strong-sac-spreyi-400-ml-guclu-tutus-pm-sgks28899
Sac Bakim,Head&Shoulders Head & Shoulders Klasik Bakım Kepek Karşıtı  Günlük Kullanım 330ML Şampuan,Head&Shoulders,109.9,4.7,941,https://www.hepsiburada.com/head-shoulders-klasik-bakim-kepek-karsiti-gunluk-kullanim-330ml-sampuan-pm-HBC00001F1BW5
Sac Bakim,Powertec TR-801 Profesyonel Saç Kurutma & Fön Makinesi - Siyah,Powertec,928.99,4.4,637,https://www.hepsiburada.com/powertec-tr-801-fon-makinesi-pm-HBC000056SOTO
Sac Bakim,Garnier Color Shampoo Retouch Açık Kahve 5.0 Amonyaksız Dip Boyası Krem Formda Hızlı Etki,Garnier,249.9,4.0,77,https://www.hepsiburada.com/garnier-color-shampoo-retouch-sampuan-kolayliginda-dip-boyasi-acik-kahve-5-0-pm-HBC0000APEHS1
Sac Bakim,Urban Care URBAN Care Style Guide Deniz Tuzu Doğal Dalga Sağlayan Şekillendirici Saç Köpüğü - Vegan - 200 ML,Urban,169.9,4.6,145,https://www.hepsiburada.com/urban-care-style-guide-deniz-tuzu-dogal-dalga-saglayan-sekillendirici-sac-kopugu-vegan-200-ml-pm-HBC00000N50I7
Sac Bakim,Head&Shoulders Mentol Ferahlığı Besleyici Şampuan 800 ml Tüm Saçlar İçin Ferahlatıcı Etki,Head&Shoulders,299.9,4.7,491,https://www.hepsiburada.com/head-shoulders-mentol-ferahligi-sampuan-800-ml-pm-HBC00007OJ04X
Sac Bakim,Bade Natural REFILL BİBERİYE SUYU Güçlendirici Saç Toniği 200 ml,Bade,599.9,4.3,464,https://www.hepsiburada.com/bade-natural-biberiye-suyu-guclendirici-sac-tonigi-refill-paket-200-ml-dogal-ve-saf-pm-HBC00006STE8R
Sac Bakim,Ogx Organix Argan Oil Of Morocco Şampuan 385 ml – Argan Saç Bakım Yağı 100 ml Set,Ogx,750.0,5.0,4,https://www.hepsiburada.com/ogx-organix-argan-oil-of-morocco-sampuan-385-ml-argan-sac-bakim-yagi-100-ml-set-pm-HBC000094L6QP
Sac Bakim,Elidor Superblend Serum Saç Bakım Kremi Anında Onarıcı Bakım C Vitamini Keratin & Seramid 350 ml,Elidor,109.9,4.8,1116,https://www.hepsiburada.com/elidor-superblend-serum-sac-bakim-kremi-aninda-onarici-bakim-c-vitamini-keratin-seramid-350-ml-pm-HBC000018QHEA
Sac Bakim,Elseve L'Oréal Paris Dökülme Karşıtı Saç Derisi Serumu 102 ml Aminexil-R™ İçeren Uzman Bakım,Elseve,468.95,4.7,40,https://www.hepsiburada.com/elseve-elseve-growth-booster-dokulme-karsiti-sac-derisi-serumu-102ml-pm-HBC00009YY3QY
Sac Bakim,Elidor Superblend Serum Saç Bakım Kremi Saç Dökülmelerine Karşı E Vitamini Chia Tohumu Yağı Keratin 350 ml,Elidor,104.4,4.7,907,https://www.hepsiburada.com/elidor-superblend-serum-sac-bakim-kremi-sac-dokulmelerine-karsi-e-vitamini-chia-tohumu-yagi-keratin-350-ml-pm-HBC000018QHEE
Sac Bakim,Head&Shoulders Erkekler Için Dökülmekarşıtı 2'si 1 Arada Şampuan 300 ml,Head&Shoulders,109.9,4.7,1679,https://www.hepsiburada.com/head-shoulders-erkekler-icin-dokulmekarsiti-2-si-1-arada-sampuan-300-ml-pm-HBC00007OJ3GF
Sac Bakim,Elidor Superblend Saç Bakım Şampuanı Anında Onarıcı Bakım C Vitamini Keratin Seramid 400 ml X3,Elidor,359.9,4.5,99,https://www.hepsiburada.com/elidor-superblend-sac-bakim-sampuani-aninda-onarici-bakim-c-vitamini-keratin-seramid-400-ml-x3-pm-HBC00004CJVCM
Sac Bakim,Ogx Biotin & Kolajen Dolgunlaştırıcı Sülfatsız Şampuan 385 ml + Argan Oil of Morocco Yenileyici Saç Bakım Yağı 100 ml,Ogx,721.76,4.8,5,https://www.hepsiburada.com/ogx-biotin-argan-yagli-hacim-verici-sampuan-385-ml-sulfatsiz-tum-saclar-icin-pm-HBC000093OKQD
Sac Bakim,Taft Schwarzkopf Taft Power Saç Spreyi Mega Güçlü 24 Saat Hacim 250 ml Kuru Yıpranmış Saçlara Kaşmir Yumuşaklığı,Taft,167.9,4.7,1448,https://www.hepsiburada.com/schwarzkopf-taft-power-sac-spreyi-mega-guclu-24-saat-hacim-250-ml-kuru-yipranmis-saclara-kasmir-yumusakligi-pm-HBC000003WLS8
Sac Bakim,Urban Care URBAN Care Shake N Repair 7/24 Glikolik Asit İçeren Gloss Laminasyon Parlaklık Etkili Durulanan Bakım Kremi 200 ml-vegan,Urban,129.9,4.6,50,https://www.hepsiburada.com/urban-care-shake-n-repair-7-24-gloss-laminasyon-durulanan-bakim-kremi-200-ml-pm-HBC000084YENH
Sac Bakim,Pantene Güç Ve Parlaklık Şampuan 400Ml,Pantene,99.9,4.7,464,https://www.hepsiburada.com/pantene-guc-ve-parlaklik-sampuan-400ml-pm-HBC00002UV14V
Sac Bakim,Elidor Superblend Saç Bakım Şampuanı Saç Dökülmelerine Karşı E Vitamini Chia Tohumu Yağı Arjinin 400 ml,Elidor,109.9,4.7,3561,https://www.hepsiburada.com/elidor-superblend-sac-bakim-sampuani-sac-dokulmelerine-karsi-e-vitamini-chia-tohumu-yagi-arjinin-400-ml-pm-HBC000018QHEI
Sac Bakim,TTO Saç ve Vücut Şampuanı 400 +100 ml,TTO,834.0,4.3,329,https://www.hepsiburada.com/tto-sac-ve-vucut-sampuani-300-100-ml-pm-HBC00000DDBIZ
Sac Bakim,L'Oréal Professionnel L'oreal Professionnel Serie Expert Absolut Repair Yıpranmış Saçlar için Onarıcı Şampuan 500 ml,L'Oréal,1075.0,4.6,693,https://www.hepsiburada.com/l-oreal-professionnel-serie-expert-absolut-repair-yipranmis-saclar-icin-onarici-sampuan-500-ml-pm-HBC00000DQXGS
Tiras Urunleri,Philips Qp2824/10 Oneblade Yüz ve Vücut Şekilendirici,Philips,1899.0,4.6,5149,https://www.hepsiburada.com/philips-qp2824-10-oneblade-yuz-ve-vucut-sekilendirici-p-HBCV00004A3FIC
Tiras Urunleri,"Gillette Sensor3 Tıraş Makinesi - 3 Bıçaklı, Kayganlaştırıcı Bant ve Oynar Başlık ile, 1 Adet + 6 Yedek Bıçak",Gillette,219.9,4.6,10155,https://www.hepsiburada.com/gillette-sensor3-tiras-makinesi-3-bicakli-kayganlastirici-bant-ve-oynar-baslik-ile-1-adet-6-yedek-bicak-pm-HB000019MB92
Tiras Urunleri,Philips OneBlade Pro QP6542/10 Elektrikli Tıraş Makinesi - Sakal & Yüz - Islak & Kuru Kullanım + Ayarlanabilir Tarak,Philips,3149.0,4.4,242,https://www.hepsiburada.com/philips-oneblade-pro-qp6542-10-elektrikli-tiras-makinesi-sakal-yuz-islak-kuru-kullanim-ayarlanabilir-tarak-pm-HBC00008QXRHQ
Tiras Urunleri,Bic Flex 5 Tıraş Bıçağı + 6 Yedek Tıraş Bıçağı + Çanta,Bic,319.89,4.7,2726,https://www.hepsiburada.com/bic-flex-5-sistem-tiras-bicagi-1-sap-6-yedek-kartus-ve-tiras-cantasi-pm-HBC00001XNOZL
Tiras Urunleri,Powertec TR-758 Profesyonel Sakal Ense Tıraş Makinesi (0.1mm - Sıfıra En Yakın),Powertec,1610.27,4.7,12419,https://www.hepsiburada.com/powertec-tr-758-profesyonel-tiras-makinesi-pm-HB00000TXJEB
Tiras Urunleri,Philips MG3920/15 Erkek Bakim Seti 7'si 1 Arada Saç & Sakal Sekillendirici,Philips,1651.55,4.6,27602,https://www.hepsiburada.com/philips-mg3920-15-erkek-bakim-seti-7-si-1-arada-sac-sakal-sekillendirici-p-HBCV00009P3IU2
Tiras Urunleri,Gillette Tıraş Köpüğü 300 ml Pürüzsüz Tıraş İçin Hafif Kıvam ve Rahatlatıcı Özellik,Gillette,149.9,4.7,5855,https://www.hepsiburada.com/gillette-tiras-kopugu-300-ml-puruzsuz-tiras-icin-hafif-kivam-ve-rahatlatici-ozellik-pm-sgsck3587
Tiras Urunleri,Powertec TR-3200 Profesyonel Şarjlı Saç Sakal Tıraş Makinesi,Powertec,1441.43,4.6,5867,https://www.hepsiburada.com/powertec-tr-3200-profesyonel-sarjli-sac-sakal-tiras-makinesi-pm-HB00000KKZN9
Tiras Urunleri,"Nivea Men Hassas Tıraş Jeli - Alkolsüz, Papatya ve E Vitamini ile Zenginleştirilmiş, 200 ml, Ultra Glide Teknolojisi ile Yakın ve Konforlu Tıraş",Nivea,204.9,4.8,1934,https://www.hepsiburada.com/nivea-men-hassas-tiras-jeli-alkolsuz-papatya-ve-e-vitamini-ile-zenginlestirilmis-200-ml-ultra-glide-teknolojisi-ile-yakin-ve-konforlu-tiras-pm-sgecz9153508
Tiras Urunleri,Gillette Mach 3 Sport 15'li Yedek Tıraş Bıçağı Hassas Cilt Dostu Sistem Özellikleriyle Üstün Konfor,Gillette,959.9,4.7,964,https://www.hepsiburada.com/gillette-mach-3-sport-tiras-bicagi-15-li-yedek-pm-HBC0000680B32
Tiras Urunleri,Gillette Mach3 Sport Yedek Tıraş Bıçağı 10 Adet Ergonomik Tasarım ile Rahat Tıraş Deneyimi,Gillette,719.9,4.7,8471,https://www.hepsiburada.com/gillette-mach3-start-yedek-tiras-bicagi-10-adet-pm-HBC00000TIIX4
Tiras Urunleri,Twinstore34 Vintage T9 Profesyonel Şarjlı Çok Fonksiyonlu Tıraş Makinesi,Twinstore34,179.0,4.0,236,https://www.hepsiburada.com/vintage-t9-profesyonel-sarjli-cok-fonksiyonlu-tiras-makinesi-pm-HBC0000636J8V
Tiras Urunleri,Philips 16'sı 1 Arada Erkek Bakım Seti MG9532/15 Şarjlı Kullanım 120 dk Süreli Gri Siyah,Philips,4299.0,4.7,83,https://www.hepsiburada.com/philips-16-si-1-arada-erkek-bakim-seti-mg9532-15-yuz-sac-vucut-islak-kuru-kullanim-pm-HBC0000ACSL0Y
Tiras Urunleri,"Philips Vücut Bakım 3000 Serisi Duşa Uygun, Hassas Bölge ve Vücut Tıraş Makinesi - BG3480/15",Philips,2957.13,4.2,31,https://www.hepsiburada.com/philips-vucut-bakim-3000-serisi-dusa-uygun-hassas-bolge-ve-vucut-tiras-makinesi-bg3480-15-pm-HBC0000CAM4YT
Tiras Urunleri,Gillette Fusion ProGlide FlexBall Tıraş Makinesi + 2 Yedek Tıraş Bıçağı,Gillette,530.0,4.7,5123,https://www.hepsiburada.com/gillette-fusion-proglide-flexball-tiras-makinesi-2-yedek-tiras-bicagi-p-SGGIL90656
Tiras Urunleri,Powertec TR-1515 Lazer-Epilasyon Öncesi Tüm Vücut Tıraş Makinesi Sakal-Ense-Vücut,Powertec,764.0,4.6,2739,https://www.hepsiburada.com/powertec-tr-1515-lazer-epilasyon-oncesi-tum-vucut-tiras-makinesi-sakal-ense-vucut-pm-HBC00002TUHB1
Tiras Urunleri,Philips QP2724/10 Oneblade Yüz Şekillendirici,Philips,1599.0,4.7,4377,https://www.hepsiburada.com/philips-qp2724-10-oneblade-yuz-sekillendirici-p-HBCV00004A3HC6
Tiras Urunleri,Gillette Fusion Avantajlı Yedek Tıraş Bıçağı 8'li,Gillette,1360.97,4.8,150,https://www.hepsiburada.com/gillette-fusion-avantajli-yedek-tiras-bicagi-8-li-pm-HBC0000515IL5
Tiras Urunleri,Philips PHILIPS MG5942/15 Erkek Bakım Seti 13'ü 1 Arada Saç & Sakal & Vücut Şekillendirici,Philips,2789.0,4.4,21,https://www.hepsiburada.com/philips-mg5942-15-erkek-bakim-seti-13-u-1-arada-sac-sakal-vucut-sekillendirici-pm-HBC0000C9I4VG
Tiras Urunleri,"Nivea Men Hassas Tıraş Köpüğü - Papatya Özlü, Alkolsüz, 200 ml, Ultra Glide Teknolojisi ile Konforlu ve Yakın Tıraş",Nivea,192.48,4.7,1826,https://www.hepsiburada.com/nivea-men-hassas-tiras-kopugu-papatya-ozlu-alkolsuz-200-ml-ultra-glide-teknolojisi-ile-konforlu-ve-yakin-tiras-pm-sgecz9153507
Tiras Urunleri,Gillette Sensor3 Yedek Tıraş Bıçağı 8 Adet Konforlu ve Pürüzsüz Tıraş İçin 3 Bıçaklı Sistem,Gillette,304.9,4.6,5119,https://www.hepsiburada.com/gillette-sensor3-yedek-tiras-bicagi-8-adet-pm-HB000018XAN4
Tiras Urunleri,Gillette Permatik 10 Adet Banyo Kullan At Tıraş Bıçağı Ergonomik Tasarımlı Hassas Cilt Dostu,Gillette,169.9,4.7,2938,https://www.hepsiburada.com/gillette-permatik-banyo-kullan-at-tiras-bicagi-10-lu-pm-sggil883981
Tiras Urunleri,"Braun Hepsi Bir Arada Series 7, 11’i 1 Arada Tıraş Kiti, Problade, Autosense, AIO7540",Braun,3049.0,4.1,69,https://www.hepsiburada.com/braun-hepsi-bir-arada-series-7-11-i-1-arada-tiras-kiti-problade-autosense-aio7540-pm-HBC00009BJV6H
Tiras Urunleri,Nivea Men Tıraş Sonrası Losyon 100 ml Alkolsüz Yağsız Hızlı Emilim Hassas Ciltlere Uygun,Nivea,279.97,4.3,1044,https://www.hepsiburada.com/nivea-men-tiras-sonrasi-losyon-100-ml-alkolsuz-yagsiz-hizli-emilim-hassas-ciltlere-uygun-pm-sgnivea0222530
Tiras Urunleri,Gillette Fusion 5 Manual Yedek 8'li Karton Ambalaj Kullan-At Özelliği ile Rahat Tıraş,Gillette,1099.0,4.6,116,https://www.hepsiburada.com/gillette-fusion-5-manual-yedek-8-li-karton-ambalaj-pm-HBC00005L58RY
Tiras Urunleri,Gillette Fusion Start Yedek Tıraş Bıçağı 8 Adet,Gillette,959.9,4.5,961,https://www.hepsiburada.com/gillette-fusion-start-yedek-tiras-bicagi-8-adet-pm-HBC000001F26I
Tiras Urunleri,Gillette Blue3 Comfort Kullan At Tıraş Bıçağı 8 Adet 3 Bıçaklı Üstün Konfor Sağlayan Tasarım,Gillette,289.9,4.7,1334,https://www.hepsiburada.com/gillette-blue3-comfort-kullan-at-tiras-bicagi-6-2-adet-pm-HB00000UMTK2
Tiras Urunleri,Powertec TR-150 Profesyonel Şarjlı Günlük Sakal Tıraş Makinesi Sinekkaydı Tıraş ve Erkek Bakım,Powertec,722.1,4.1,1365,https://www.hepsiburada.com/powertec-tr-150-sarjli-sakal-tiras-makinesi-pm-HBC00001FM319
Tiras Urunleri,Powertec TR-650 (TAHRİŞ KARŞITI) Şarjlı Epilasyon Öncesi Hassas Vücut Tıraş Makinesi Çift Bıçak 2 Yıl Garanti,Powertec,922.68,4.4,193,https://www.hepsiburada.com/powertec-tr-650-body-vucut-tiras-makinasi-pm-HBC00004K46Y0
Tiras Urunleri,Philips PHILIPS MG5922/15 Erkek Bakım Seti 10'u 1 Arada Saç & Sakal & Vücut Şekillendirici,Philips,2738.76,4.6,47,https://www.hepsiburada.com/philips-mg5922-15-erkek-bakim-seti-10-u-1-arada-sac-sakal-vucut-sekillendirici-pm-HBC0000C9M676
Tiras Urunleri,"Philips PHILIPS MG7922/15 Erkek Bakım Seti 13'ü 1 Arada Saç & Sakal & Vücut Şekillendirici, Hızlı Şarj Özelliği",Philips,3199.0,4.2,57,https://www.hepsiburada.com/philips-mg7922-15-erkek-bakim-seti-13-u-1-arada-sac-sakal-vucut-sekillendirici-hizli-sarj-ozelligi-pm-HBC0000C9NF4L
Tiras Urunleri,Gillette Proglide Tıraş Makinesi ve Yedek Bıçağı 4'lü + Tıraş Bıçağı Standı,Gillette,799.9,4.7,334,https://www.hepsiburada.com/gillette-proglide-tiras-makinesi-ve-yedek-bicagi-4-lu-tiras-bicagi-standi-pm-HBC00006DOIF6
Tiras Urunleri,Gillette Fusion Proglide 5 Bıçaklı Tıraş Ürünü 2'li Paket Hassas Cilt Dostu Erkekler İçin,Gillette,444.9,4.4,7989,https://www.hepsiburada.com/gillette-fusion-proglide-5-bicakli-tiras-urunu-2-li-paket-hassas-cilt-dostu-erkekler-icin-p-SGGIL5897
Tiras Urunleri,Gillette Mach 3 Turbo Yedek Bıçak 12'li Ergonomik Tasarımlı Sistem Bıçakları ile Konforlu Tıraş,Gillette,1169.0,4.2,28,https://www.hepsiburada.com/gillette-mach-3-turbo-yedek-bicak-12-li-pm-HBC0000A5LKJC
Tiras Urunleri,Philips Philps Philips 14'ü 1 Arada Erkek Bakım Seti - Yüz/saç/vücut (Islak/kuru Kullanım) MG7930/15,Philips,3174.63,4.3,207,https://www.hepsiburada.com/philips-14-u-1-arada-erkek-bakim-seti-yuz-sac-vucut-islak-kuru-kullanim-mg7930-15-pm-HBC00005FQZWX
Tiras Urunleri,Moser 1400-0050 Profesyonel Saç Kesme Makinesi  Kırmızı Renkli,Moser,1394.0,4.5,1920,https://www.hepsiburada.com/moser-1400-0278-profesyonel-sac-kesme-makinesi-pm-sgks3248
Tiras Urunleri,Bic Flex 5 Hybrid Yedek Tıraş Bıçağı Kartuşu 4'lü (5 Bıçak Sapsız),Bic,249.9,4.7,1793,https://www.hepsiburada.com/bic-flex-5-hybrid-yedek-tiras-bicagi-kartusu-4-lu-kutu-5-bicak-pm-HBC00000JR8PY
Tiras Urunleri,"Nivea Men Hassas Ciltler İçin Hoş Kokulu Tıraş Sonrası Balsam - 100 ml, Alkolsüz, Papatya ve Hamamelis Özleriyle Zenginleştirilmiş",Nivea,309.97,4.7,845,https://www.hepsiburada.com/nivea-men-hassas-ciltler-icin-hos-kokulu-tiras-sonrasi-balsam-100-ml-alkolsuz-papatya-ve-hamamelis-ozleriyle-zenginlestirilmis-pm-sgecz9153523
Tiras Urunleri,Gillette Fusion Start Yedek Tıraş Bıçağı 4 Adet,Gillette,569.9,4.5,1373,https://www.hepsiburada.com/gillette-fusion-start-yedek-tiras-bicagi-4-adet-pm-HBC000001F26E
Tiras Urunleri,Gillette Fusion5 Tıraş Makinesi ve Yedek Bıçağı 5'li + Tıraş Bıçağı Standı,Gillette,809.9,4.7,383,https://www.hepsiburada.com/gillette-fusion5-tiras-makinesi-ve-yedek-bicagi-5-li-tiras-bicagi-standi-pm-HBC00006DOJLK
Tiras Urunleri,Powertec TR-1220 Pro Usb Şarjlı Dijital T-Bıçak Sakal Vücut Kıl Tüy Alma Kadın Erkek Epilasyon Tıraş Makinesi,Powertec,629.0,4.3,133,https://www.hepsiburada.com/tr-1220-sakal-ense-cizim-makinesi-t-bicak-pm-HBC00006XFQ4O
Tiras Urunleri,"Philips 3000 Serisi Islak&Kuru Tıraş Makinesi, 5 Yönde Dönen Başlıklar, Hassas Düzeltici, S3144/00",Philips,2616.0,4.4,534,https://www.hepsiburada.com/philips-3000-serisi-islak-kuru-tiras-makinesi-5-yonde-donen-basliklar-hassas-duzeltici-s3144-00-pm-HBC00005OMNLH
Tiras Urunleri,Grundig mt 3810 Burun Kulak Kılı Kesme Makinesi Siyah,Grundig,599.53,4.3,222,https://www.hepsiburada.com/grundig-mt-3810-burun-kulak-kili-kesme-makinesi-siyah-pm-HBC00006JE6C2
Tiras Urunleri,Gillette Fusion ProGlide 8'li Yedek Tıraş Bıçağı Karton Paket,Gillette,1499.0,4.4,2697,https://www.hepsiburada.com/gillette-fusion-proglide-8-li-yedek-tiras-bicagi-karton-paket-pm-HB000004DIXC
Tiras Urunleri,Gillette Mach3 Start Tıraş Makinesi + Yedek Tıraş Bıçağı Ergonomik Tasarım ile Hassas Tıraş Deneyimi,Gillette,229.9,4.7,200,https://www.hepsiburada.com/gillette-mach3-start-tiras-makinesi-yedek-tiras-bicagi-pm-HBC00000DCID8
Tiras Urunleri,Gillette Mach 3 Start Tıraş Bıçağı 4' lü,Gillette,369.9,4.7,2893,https://www.hepsiburada.com/gillette-mach-3-start-tiras-bicagi-4-lu-pm-HB00000LNBC0
Tiras Urunleri,Rowenta TN9444 Selectium 15 in 1 Çok Amaçlı Tıraş Makinesi,Rowenta,1999.0,4.6,34,https://www.hepsiburada.com/rowenta-tn9444-selectium-15-in-1-cok-amacli-tiras-makinesi-pm-HBC00008FVRX1
Tiras Urunleri,"Wahl 3615-1016 Seyahat İçin Kablosuz Şarjlı Tıraş Makinesi - Kompakt, LED Göstergeli ve Taşıma Çantası ile, Siyah",Wahl,798.98,4.3,802,https://www.hepsiburada.com/wahl-3615-1016-seyahat-icin-kablosuz-sarjli-tiras-makinesi-kompakt-led-gostergeli-ve-tasima-cantasi-ile-siyah-p-HBV00000A5LVM
Tiras Urunleri,Braun Series 7 BT7420 Sakal Düzeltici,Braun,2499.0,4.7,118,https://www.hepsiburada.com/braun-series-7-bt7420-sakal-duzeltici-pm-HBC00004VCFVG
Tiras Urunleri,Philips 13'ü 1 Arada Erkek Bakım Seti - Yüz/saç/vücut (Islak/kuru Kullanım) MG7920/15,Philips,3131.13,4.5,1972,https://www.hepsiburada.com/philips-13-u-1-arada-erkek-bakim-seti-yuz-sac-vucut-islak-kuru-kullanim-mg7920-15-pm-HBC000051HF8G
Tiras Urunleri,Philips OneBlade QP2724/20 Elektrikli Tiras Makinesi - Sakal & Vücut - Islak & Kuru Kullanim,Philips,1649.0,4.6,2485,https://www.hepsiburada.com/philips-oneblade-qp2724-20-elektrikli-tiras-makinesi-sakal-vucut-islak-kuru-kullanim-pm-HBC000046IASZ
Tiras Urunleri,Gillette Blue3 Comfort Kullan At Tıraş Bıçağı 12 Adet 9+3 Hassas Cilt Dostu Ergonomik Tasarım,Gillette,399.9,4.7,2125,https://www.hepsiburada.com/gillette-blue3-comfort-kullan-at-tiras-bicagi-9-3-adet-pm-HBC00001FZOJH
Tiras Urunleri,Gillette Fusion 5 12’li Yedek Tıraş Bıçağı Hassas Cilt Dostu Ergonomik Tasarım ile Konforlu Tıraş,Gillette,1479.0,4.5,24,https://www.hepsiburada.com/gillette-fusion-5-yedek-tiras-bicagi-12-li-pm-HBC0000A63FJZ
Tiras Urunleri,Nivea Men NIVEA Men Deep Dimension Tıraş Jeli 200ml; Kusursuz Tıraş,Nivea,294.9,4.7,1143,https://www.hepsiburada.com/nivea-men-deep-dimension-tiras-jeli-200ml-kusursuz-tiras-pm-HB00000BS150
Tiras Urunleri,Trina Professional Burun Ve Kulak Kılı Kesme Makinası Pilli Kablosuz Kullanım 20 dk Süreli Etkili Temizlik,Trina,297.0,4.0,4293,https://www.hepsiburada.com/trina-professional-burun-ve-kulak-kili-kesme-makinasi-pm-sgba7294
Tiras Urunleri,Gillette Mach 3 Start Erkek Tıraş Bıçağı 2'li Aqua-Grip Sapa ile Hassas Tıraş Deneyimi,Gillette,189.9,4.7,465,https://www.hepsiburada.com/gillette-mach3-start-yedek-tiras-bicak-2-li-pm-HB00000LNBBQ
Tiras Urunleri,Powertec TR-558 Profesyonel Şarjlı Saç Sakal Ense T-bıçak Tıraş Makinesi,Powertec,969.0,4.6,1784,https://www.hepsiburada.com/powertec-tr-558-tiras-makinesi-pm-HB00000S0ZA1
Tiras Urunleri,"Emtu Life LI-1386 Erkek Bakım Kiti,saç Sakal ve Tüm Vücut Bakım Seti 6 In 1 -10W",Emtu,1086.63,4.2,364,https://www.hepsiburada.com/emtu-life-li-1386-erkek-bakim-kiti-sac-sakal-ve-tum-vucut-bakim-seti-6-in-1-10w-pm-HBC00005LQGAA
Tiras Urunleri,Philips 1000 Serisi Erkek Vücut Bakım Seti - BG1024/15,Philips,1537.29,4.4,4362,https://www.hepsiburada.com/philips-1000-serisi-erkek-vucut-bakim-seti-bg1024-15-pm-HBC000028LC4C
Tiras Urunleri,Powertec TR-1818 Sakal Ense Çizim Tıraş Makinesi,Powertec,1251.93,4.6,6942,https://www.hepsiburada.com/powertec-1818-tiras-makinesi-pm-HB00000ZNLKC
Tiras Urunleri,Powertec TR-4100 Profesyonel Saç Sakal Tıraş Makinesi,Powertec,2775.0,4.5,155,https://www.hepsiburada.com/powertec-tr-4100-sac-sakal-tiras-makinesi-pm-HBC0000594SLE
Tiras Urunleri,Gillette Mach3 Charcoal 2Up + Charcoal Series Jel 200ML + Çanta,Gillette,489.9,4.8,204,https://www.hepsiburada.com/gillette-mach3-charcoal-2up-charcoal-series-jel-200ml-canta-pm-HBC00006W0SF4
Tiras Urunleri,"Braun Vücut Tıraş Makinesi Series 5, +6 Aksesuar, Su Geçirmez, BG5550",Braun,2999.0,4.7,27,https://www.hepsiburada.com/braun-vucut-tiras-makinesi-series-5-6-aksesuar-su-gecirmez-bg5550-pm-HBC00009C95J7
Tiras Urunleri,Gillette Blue3 Slalom Kullan At Tıraş Bıçağı 12'li Paslanmaz Çelik ile Profesyonel Tıraş Deneyimi,Gillette,359.9,4.6,308,https://www.hepsiburada.com/gillette-blue3-slalom-kullan-at-tiras-bicagi-12-li-pm-HBC000046CFRU
Tiras Urunleri,"Braun Vücut Tıraş Makinesi Series 7, +6 Aksesuar, Kompakt, Smartlight, BG7550",Braun,3779.0,4.3,29,https://www.hepsiburada.com/braun-vucut-tiras-makinesi-series-7-6-aksesuar-kompakt-smartlight-bg7550-pm-HBC00009C95J9
Tiras Urunleri,Powertec TR-3100 Saç Sakal Kesim Makinesi,Powertec,1331.1,4.6,120,https://www.hepsiburada.com/powertec-tr-3100-sac-kesim-makinasi-pm-HBC00006TMWQM
Tiras Urunleri,"Braun Hepsi Bir Arada Series 3, 8’i 1 Arada Tıraş Kiti, Keskin Bıçak, 14 Uzunluk, AIO3540",Braun,1493.94,4.6,28,https://www.hepsiburada.com/braun-hepsi-bir-arada-series-3-8-i-1-arada-tiras-kiti-keskin-bicak-14-uzunluk-aio3540-pm-HBC00009BC0XT
Tiras Urunleri,Bic Flex 5 Hybrid Tıraş Bıçağı Seti 1 Gövde + 10 Yedek Başlık - 5 Bıçaklı Erkek Tıraş Bıçağı,Bic,699.9,4.9,110,https://www.hepsiburada.com/bic-flex-5-hybrid-tiras-bicagi-seti-1-govde-10-yedek-baslik-5-bicakli-erkek-tiras-bicagi-pm-HBC000071WMM1
Tiras Urunleri,Wahl 5545-2416 3 in 1 Kulak-Burun Tüy Kesme Makinesi,Wahl,504.0,4.3,152,https://www.hepsiburada.com/wahl-3-in-1-kulak-burun-tuy-kesme-makinesi-05545-2416-pm-HB00000T8I28
Tiras Urunleri,"Braun MGK 3410  6'sı 1 Arada Ultra Keskin Bıçaklı Tıraş ve Şekillendirme Makinesi, Islak/Kuru Kullanım,Tamamen Yıkanabilir",Braun,1448.55,4.2,146,https://www.hepsiburada.com/braun-mgk-3410-6-si-1-arada-ultra-keskin-bicakli-tiras-ve-sekillendirme-makinesi-islak-kuru-kullanim-tamamen-yikanabilir-pm-HBC00004UXI7X
Tiras Urunleri,Powertec TR-6500 Yedek Bataryalı Şarjlı Tıraş Makinesi,Powertec,1404.18,4.6,2520,https://www.hepsiburada.com/tr-6500-yedek-bataryali-sarjli-tiras-makinesi-pm-HB000002NOWG
Tiras Urunleri,Powertec TR-858 Profesyonel Usb Şarjlı Saç Sakal Ense Vücut Tıraş Makinesi,Powertec,1304.0,4.7,2147,https://www.hepsiburada.com/powertec-tr-858-tiras-makinesi-pm-HB00000RC7VG
Agiz Bakim,Opalescence Beyazlatıcı Diş Macunu 133 gr Cool Mint Aromalı Yüzey Lekelerini Gideren Etkili Formül,Opalescence,498.89,4.5,17872,https://www.hepsiburada.com/opalescence-cool-mint-dis-macunu-133-gr-100-ml-pm-HB000008ITBQ
Agiz Bakim,Babyton Silikon Diş Fırçası,Babyton,423.75,4.8,342,https://www.hepsiburada.com/babyton-silikon-bebek-dis-fircasi-ergonomik-tasarim-6-24-ay-icin-toksik-olmayan-plastik-pm-HBC00006D6XS6
Agiz Bakim,Siveno %100 Doğal Diş Macunu Bebek ve Çocuk İçin Karışık Meyve Aromalı Florürsüz 50 ml,Siveno,441.86,4.6,987,https://www.hepsiburada.com/siveno-dogal-florursuz-karisik-meyve-aromali-bebek-ve-cocuk-icin-dis-macunu-50-ml-pm-HBC00006RXMSC
Agiz Bakim,Oral White Paslanmaz Çelik Dil Temizleyici Ve Sıyırıcı 2 Parça Orta Sertlikte Fırça Kılı,Oral,169.99,4.7,483,https://www.hepsiburada.com/oral-white-paslanmaz-celik-dil-temizleyici-ve-dil-siyirici-2-parca-pm-HBC00005JFDIX
