Kategori,Urun Adi,Marka,Fiyat (TL),Puan,Yorum Sayisi,Link
Cilt Bakim,Bade Natural %100 Saf Doğal Lavanta Uçucu Yağı 10 ml Unisex Buhar Distilasyonu ile Yatıştırıcı,Bade,289.9,4.7,478,https://www.hepsiburada.com/bade-natural-100-saf-dogal-lavanta-ucucu-yagi-10-ml-unisex-buhar-distilasyonu-ile-yatistirici-pm-HB00000GQLZH
Cilt Bakim,Nivea NIVEA Creme 30ml Bakım Yapan Koruma,Nivea,120.0,4.7,871,https://www.hepsiburada.com/nivea-creme-30ml-bakim-yapan-koruma-pm-sgez9101014
Cilt Bakim,Nivea NIVEA El Kremi Zeytinyağlı Nemlendirici Bakım Kremi 75ml;48 Saat Neme Doymuş ve Yumuşacık Eller,Nivea,114.97,4.6,298,https://www.hepsiburada.com/nivea-el-kremi-zeytinyagli-nemlendirici-bakim-kremi-75ml-48-saat-neme-doymus-ve-yumusacik-eller-pm-HB00000HUFY5
Cilt Bakim,"Nivea Değerli Yağlar İçeren Nemlendirici Vücut Losyonu Kiraz Çiçeği 400ml, Jojoba Yağı, Kuru Cilt Tipleri",Nivea,299.9,4.7,646,https://www.hepsiburada.com/nivea-degerli-yaglar-iceren-vucut-losyonu-kiraz-cicegi-jojoba-yagi-400ml-normal-kuru-ciltler-icin-24-saat-nemlendirme-hizli-emilen-losyon-pm-HB000006N3FU
Cilt Bakim,Bioderma Sensibio H2O 500 ml x 2 Adet Hassas Ciltler İçin Etkili Temizleme Seti,Bioderma,1429.0,4.8,1441,https://www.hepsiburada.com/bioderma-sensibio-h2o-micellar-water-500-ml-x-2-adet-pm-HBC00007BGQV6
Cilt Bakim,La Roche-Posay Toleriane Hassas Ciltler İçin Temizleyici Yüz Temizleme Jeli 400 ml,La,1145.9,4.3,44,https://www.hepsiburada.com/la-roche-posay-toleriane-hassas-ciltler-dahil-tum-ciltler-icin-temizleme-jeli-400-ml-pm-HBC0000AOB3EH
Cilt Bakim,Kiehl's Ultra Facial Cream & Avokadolu Göz Kremi 2 Adet Kavanoz Seti Tüm Cilt Tipleri İçin Nemlendirici,Kiehl's,1940.0,4.4,670,https://www.hepsiburada.com/kiehl-s-ultra-facial-cream-avokadolu-goz-kremi-favori-nem-ikilisi-seti-pm-HBC00006UF6ZM
Cilt Bakim,La Roche-Posay La Roche Posay Lipikar AP+M Nemlendirici Balsam 75 ml Kuru-Atopiye Eğilimli Ciltler İçin Nemlendirici,La,925.06,4.7,1228,https://www.hepsiburada.com/la-roche-posay-lipikar-ap-m-nemlendirici-balsam-75-ml-kuru-atopiye-egilimli-ciltler-icin-pm-HB00000RFDTG
Cilt Bakim,La Roche-Posay Hyalu B5 Dolgunlaştırıcı Serum 30 ml Hassas Ciltler İçin Hyaluronik Asit Etkisi,La,2632.08,4.3,1287,https://www.hepsiburada.com/la-roche-posay-hyalu-b5-dolgunlastirici-serum-30-ml-hassas-ciltler-icin-hyaluronik-asit-etkisi-pm-HB00000RENXX
Cilt Bakim,"The Purest Solutions,Yağlı Ve Karma Cilt Tonik 200 ml",The,385.0,4.6,4921,https://www.hepsiburada.com/the-purest-solutions-yagli-ve-karma-cilt-tonik-200-ml-pm-HBC00000X9X47
Cilt Bakim,S'hevec S'he Vec Gözenek Sıkılaştırıcı ve Leke Karşıtı Glikolik Asit 200 ml Vegan Tonik Glyc–Alright,S'hevec,319.0,4.6,7787,https://www.hepsiburada.com/s-he-vec-glyc-alright-tum-ciltler-icin-leke-karsiti-tonik-200-ml-pm-HBC000014VXAU
Cilt Bakim,La Roche-Posay Toleriane Sensitive Prebiyotik Nemlendirici Hassas Ciltler 40Ml,La,1299.9,4.6,667,https://www.hepsiburada.com/la-roche-posay-toleriane-sensitive-prebiyotik-nemlendirici-hassas-ciltler-40ml-pm-HB00000BGVJ2
Cilt Bakim,"Bioderma Sebium Hydra Seramid İçeren Yatıştırıcı, Kurutucu Akne Tedavisi Yoğun Nemlendirici Bakım Kremi 40 ML",Bioderma,1099.0,4.7,1092,https://www.hepsiburada.com/bioderma-sebium-hydra-nemlendirici-krem-40-ml-kuru-ciltler-icin-yogun-nemlendirme-ve-bariyer-onarimi-gunluk-bakim-pm-sgbe3401348840421
Cilt Bakim,The Purest Solutions 30 ml Niacinamide Serum Arındırıcı Etkili Karma Ciltler İçin Özel Formül,The,309.9,4.5,7466,https://www.hepsiburada.com/the-purest-solutions-olusumunu-ye-bakim-serumu-niacinamide-5-zinc-pca1-tps100-pm-HB0000119L52
Cilt Bakim,Klavuu Nourishing Care Lip Sleeping Pack Berry - Orman Meyveleri Özlü Besleyici Dudak Bakım Gece Maskesi,Klavuu,749.9,4.5,113,https://www.hepsiburada.com/klavuu-nourishing-care-lip-sleeping-pack-berry-orman-meyveleri-ozlu-besleyici-dudak-bakim-gece-maskesi-p-HBCV00004E0TJJ
Cilt Bakim,MjCare Mjcare Miracle Foot Peeling Pack - Mjcare Çorap Tipi Ayak Peeling Maskesi 2'li,MjCare,293.99,4.1,2140,https://www.hepsiburada.com/mjcare-miracle-foot-peeling-pack-mjcare-corap-tipi-ayak-peeling-maskesi-2-li-pm-HBC00003O0K7B
Cilt Bakim,Cosmed Temizleme Yağı /ATOPIA CLEANSING OIL 200 ML,Cosmed,399.0,4.5,1888,https://www.hepsiburada.com/cosmed-atopia-cleansing-oil-yuz-ve-vucut-icin-temizleme-yagi-yag-bazli-temizleyici-200-ml-pm-HBC00002LZSON
Cilt Bakim,L'Oréal Paris L'oréal Paris Revitalift Filler Glassy Skin Cam Cilt Görünümü Veren [hyaluronik Asit] Içeren Nemlendirici Krem 50ML,L'Oréal,699.95,4.8,82,https://www.hepsiburada.com/l-or-al-paris-revitalift-filler-glassy-skin-cam-cilt-gorunumu-veren-hyaluronik-asit-iceren-nemlendirici-krem-50ml-pm-HBC0000BTB7FY
Cilt Bakim,"Clinique Moisture Surge™ 100 Saat Etkili Nemlendirici Yüz Kremi 15ml | Aloe Vera BioFerment, Hyalüronik Asit",Clinique,649.0,4.6,1733,https://www.hepsiburada.com/clinique-moisture-surge-100-saat-etkili-nemlendirici-15-ml-pm-HBC00000CTPB4
Cilt Bakim,"Kremi kremi Dudak Bakım Parlatıcı Lip Balm 13 ml Peach| Besleyici, Nemlendirici | Peptit, Seramid, E Vitamini",Kremi,242.9,4.4,522,https://www.hepsiburada.com/kremi-nemlendirici-besleyici-parlatici-peptit-ve-seramid-icerikli-parlatici-lip-balm-pm-HBC00006BRK37
Cilt Bakim,"CeraVe Köpüren Temizleyici Jel - Yağlı ve Normal Ciltler İçin, Hyaluronik Asit ve Seramid ile Zenginleştirilmiştir, 473 ml",CeraVe,1269.9,4.5,2300,https://www.hepsiburada.com/cerave-kopuren-temizleyici-jel-yagli-ve-normal-ciltler-icin-hyaluronik-asit-ve-seramid-ile-zenginlestirilmistir-473-ml-pm-HB00000EH18O
Cilt Bakim,CeraVe Cerave Akneye Eğilimli Ciltlere Özel Temizleyici 236 ml K35600,CeraVe,1099.9,4.5,833,https://www.hepsiburada.com/cerave-akneye-egilim-gosteren-ciltler-icin-ozel-temizleyici-236-ml-pm-HBC00002XREHK
Cilt Bakim,La Roche-Posay Koyu Leke Karşıtı Koruyucu Cilt Bakım Seti: Mela B3 Yüz Temizleyici 200ML & Anthelios Uvmune Fluid 15ML,La,1073.9,4.5,12,https://www.hepsiburada.com/koyu-leke-karsiti-koruyucu-cilt-bakim-seti-mela-b3-yuz-temizleyici-200ml-anthelios-uvmune-fluid-15ml-pm-HBC0000D3AYE7
Cilt Bakim,Bade Natural Pembe Kuvars Taşlı Göz Altı Antioksidan Masaj Serumu 10 ml,Bade,379.9,4.3,336,https://www.hepsiburada.com/bade-natural-antioksidan-etkili-pembe-kuvars-roll-on-serum-pm-HBC000011HPRQ
Cilt Bakim,CeraVe Skin Renewing Retinol Serum 30 ml Kırışıklık Karşıtı Tüm Cilt Tipleri İçin Etkili Bakım,CeraVe,2149.9,4.8,21,https://www.hepsiburada.com/cerave-skin-renewing-retinol-serum-30-ml-pm-HBC0000AQ1Q45
Cilt Bakim,Siveno %100 Doğal Papatya Suyu Aydınaltma Etkili Arındırıcı Rahatlatıcı Saç ve Cilt Toniği,Siveno,533.11,4.3,60,https://www.hepsiburada.com/siveno-100-dogal-papatya-suyu-aydinaltma-etkili-arindirici-rahatlatigi-sac-ve-cilt-tonigi-pm-HBC00009QZBKV
Cilt Bakim,Mila Care Arı Zehri Kremi 100ml,Mila,389.0,4.0,228,https://www.hepsiburada.com/bee-venom-ari-zehri-kremi-100ml-pm-HBC00003MX0JY
Cilt Bakim,La Roche-Posay Toleriane Hassas Ciltler İçin Yüz Bakım Seti – Nazik Temizleyici ve Nemlendirici Ürünler,La,1299.9,4.3,43,https://www.hepsiburada.com/la-roche-posay-toleriane-hassas-ciltler-icin-yuz-bakim-seti-nazik-temizleyici-ve-nemlendirici-urunler-pm-HBC000058G7SE
Cilt Bakim,Bioderma Sensibio Ar+ Krem 40 Ml Dermatolojik Olarak Test Edilmiş Hassas Ciltler İçin,Bioderma,1939.0,4.5,71,https://www.hepsiburada.com/bioderma-sensibio-ar-krem-40-ml-dermatolojik-olarak-test-edilmis-hassas-ciltler-icin-pm-HBC000087OB3I
Cilt Bakim,Bade Natural Okaliptus Uçucu Yağı %100 Saf 10 ml,Bade,289.9,4.8,275,https://www.hepsiburada.com/bade-natural-okaliptus-ucucu-yagi-10-ml-pm-HB00000GQLZL
Cilt Bakim,MISSHA Aloe Vera Özlü Esnek Görünüm Sunan Nemlendirici Yaprak Maske MISSHA Airy Fit Sheet Mask (Aloe),MISSHA,69.9,4.6,3782,https://www.hepsiburada.com/aloe-vera-ozlu-esnek-gorunum-sunan-nemlendirici-yaprak-maske-missha-airy-fit-sheet-mask-aloe-p-HBV00000UOF1U
Cilt Bakim,"Farmasi Dr. Cevdet Tuna At Kestanesi Balsamı - 500 ml, Unisex Nemlendirici, Serinletici ve Rahatlatıcı Etki",Farmasi,380.0,4.6,2124,https://www.hepsiburada.com/farmasi-dr-cevdet-tuna-at-kestanesi-balsami-500-ml-unisex-nemlendirici-serinletici-ve-rahatlatici-etki-pm-HB00000TKVGZ
Cilt Bakim,Cosmed Özel Seri -Temizleme Yağı - Cleansing Oil - 340 ml,Cosmed,399.0,4.8,6,https://www.hepsiburada.com/cleansing-oil-sevgililer-gunu-ozel-paket-pm-HBC0000CPRDEM
Cilt Bakim,La Roche-Posay La Roche Posay Saf Vitamin C12 Işıltı Veren Serum 30 ml,La,2650.0,4.2,48,https://www.hepsiburada.com/la-roche-posay-la-roche-posay-saf-vitamin-c12-isilti-veren-serum-30-ml-pm-HBC00007CC4VC
Cilt Bakim,"The Purest Solutions  ve , Onarıcı Retinol (A vitamini ) Gece Serumu 30 ml (1% Retinol + Ceramide)",The,434.99,4.6,3202,https://www.hepsiburada.com/the-purest-solutions-vita-a-serum-onarici-besleyici-retinol-serum-1-retinol-ceramide-tps201-pm-HBC00000X9X3X
Cilt Bakim,"Nivea Soft Nemlendirici Bakım Kremi 300ml, Jojoba Yağı, Hızlı Emilir, Yağlı His Bırakmaz, El Yüz Vücut",Nivea,209.9,4.7,1948,https://www.hepsiburada.com/nivea-soft-nemlendirici-bakim-kremi-300ml-jojoba-yagi-hizli-emilir-yagli-his-birakmaz-el-yuz-vucut-pm-sgnivea9371
Cilt Bakim,Cream Co. Su Bazlı Bariyer Onarıcı Cloud Moisturizer Yatıştırıcı Nemlendirici Yüz Kremi 50 ML Tüm Cilt Tipleri,Cream,596.8,4.5,1298,https://www.hepsiburada.com/moisturizer-su-bazli-nemlendirici-yuz-kremi-yatistirici-bariyer-onarici-tum-cilt-tipleri-pm-HBC00004VE1VT
Cilt Bakim,La Roche-Posay La Roche Posay Lipikar Baume Light Ap+M 400 ml,La,1549.88,4.5,608,https://www.hepsiburada.com/la-roche-posay-lipikar-baume-light-ap-m-400-ml-pm-HBC00002XREHI
Cilt Bakim,Siveno %100 Doğal Dudak Koruyucu Yoğun Etki Bitkisel Lipbalm Krem Nemlendirici Parlatıcı Onarıcı 6 G,Siveno,399.77,4.6,629,https://www.hepsiburada.com/siveno-100-dogal-dudak-koruyucu-yogun-etki-bitkisel-lipbalm-krem-nemlendirici-parlatici-onarici-6-g-pm-HB00000AJ0KY
Gunes Bakim,Bade Natural %100 Doğal ve Mineral Filtreli Yüksek Korumalı Çocuk Güneş Koruyucu Stick 16g,Bade,449.9,4.3,575,https://www.hepsiburada.com/bade-natural-100-dogal-ve-mineral-filtreli-yuksek-korumali-cocuk-gunes-koruyucu-stick-pm-HBC000068SEGN
Gunes Bakim,MISSHA Ton Eşitleyici Aydınlatıcı Güneş Kremi 50ml A'PIEU Power Block Tone Up Base Pink SPF50+/PA++++,MISSHA,625.41,4.7,7781,https://www.hepsiburada.com/missha-ton-esitleyici-aydinlatici-gunes-kremi-50ml-a-pieu-power-block-tone-up-base-pink-spf50-pa-pm-HB00000UEUTE
Gunes Bakim,Minela Care 100% Organik Mineral Filtreli Bebek ve Çocuk Güneş Kremi Spf 50 110 gr PA++++,Minela,599.0,4.3,649,https://www.hepsiburada.com/minela-care-organik-mineral-filtreli-bebek-ve-cocuk-gunes-kremi-spf-50-110-gr-pm-HBC00006440HJ
Gunes Bakim,La Roche-Posay Anthelios Uvmune Yüz Güneş Kremi SPF50+ Lekeli Ciltler İçin Renksiz Krem,La,841.91,4.0,183,https://www.hepsiburada.com/la-roche-posay-anthelios-uvmune-yuz-gunes-kremi-spf50-lekeli-ciltler-icin-renksiz-krem-pm-HBC0000846E3O
Gunes Bakim,Siveno %100 Doğal Bebek Güneş Kremi Leke Karşıtı Antioksidan Nemlendirici Bitkisel Vegan SPF 50+ UVA UVB  50 ml,Siveno,727.99,4.7,2877,https://www.hepsiburada.com/siveno-100-dogal-bebek-gunes-kremi-leke-karsiti-antioksidan-nemlendirici-bitkisel-vegan-uva-uvb-spf-50-50-ml-pm-HBC0000C4O1HA
Gunes Bakim,"La Roche-Posay Anthelios Oil Control Fluid Spf 50+ Güneş Kremi 50 ml, Yağlı/Karma ve Hassas Ciltler İçin",La,1399.0,4.4,1459,https://www.hepsiburada.com/anthelios-oil-control-fluid-spf-50-gunes-kremi-50-ml-yagli-karma-ve-hassas-ciltler-icin-pm-HBC0000475YNY
Gunes Bakim,Bioderma Photoderm SPOT SPF50+ Yüksek Korumalı Yüz ve Vücut Güneş Kremi 150 ml,Bioderma,1289.0,4.5,5742,https://www.hepsiburada.com/bioderma-photoderm-spot-spf50-yuksek-korumali-yuz-ve-vucut-gunes-kremi-150-ml-pm-HB00000IMEJ6
Gunes Bakim,La Roche-Posay Anthelios Uvmune 400 Spf 50+ Güneş Kremi 50 ml - Tüm Cilt Tipleri İçin,La,698.8,4.3,15090,https://www.hepsiburada.com/anthelios-uvmune-400-spf-50-gunes-kremi-50-ml-tum-cilt-tipleri-icin-pm-HB00000IWKZ8
Gunes Bakim,L'Oréal Paris Revitalift Clinical Spf 50+ Günlük Yüksek Uv Korumalı Yüz Güneş Kremi 50ml,L'Oréal,275.0,4.5,3716,https://www.hepsiburada.com/l-or-al-paris-revitalift-clinical-spf-50-gunluk-yuksek-uv-korumali-yuz-gunes-kremi-50ml-pm-HBC00003THK6N
Gunes Bakim,Avene Stick Güneş Kremi SPF 50+ Hassas Bölgeler için Yüksek Koruma Sağlayan Güneş Koruyucu 8 gr,Avene,690.49,4.5,859,https://www.hepsiburada.com/avene-eau-thermale-stick-zones-sensibles-spf50-8g-hassas-bolgeler-icin-pm-HB00001BTZ2Z
Gunes Bakim,Siveno %100 Doğal Yüz Güneş Kremi Leke Karşıtı Aydınlatıcı Çinko Mineral Filtre SPF 50+ UVA UVB 30 ml,Siveno,1244.22,4.5,264,https://www.hepsiburada.com/siveno-dogal-yuz-gunes-kremi-aydinlatici-cinko-mineral-filtre-uva-uvb-spf-50-30-ml-pm-HBC00007H0421
Gunes Bakim,Sebamed Sun Care UVA / UVB Filtresi ve E Vitamini Üçlü Yüksek Koruma Çok Yönlü Güneş Kremi 50 SPF 50 ml,Sebamed,359.9,4.3,361,https://www.hepsiburada.com/sebamed-sun-care-uva-uvb-filtresi-ve-e-vitamini-uclu-yuksek-koruma-cok-yonlu-gunes-kremi-50-spf-50-ml-pm-HB00000EH1V6
Gunes Bakim,Bioderma Photoderm XDefense Spf50+ Tüm Cilt Tipleri Antioksidan Etkili Akışkan Güneş Kremi Renksiz 40 ml,Bioderma,888.0,4.3,124,https://www.hepsiburada.com/bioderma-photoderm-xdefense-ultrafluid-gunes-kremi-spf50-tum-cilt-tipleri-icin-renksiz-ve-suya-dayanikli-yaz-aylari-icin-ideal-40-ml-pm-HBC000084YWIK
Gunes Bakim,Bade Natural  Doğal 50+ Spf Yüksek Korumalı Çocuk Güneş Koruyucu Losyon Mineral Filtreli 100 ml,Bade,449.9,4.7,43,https://www.hepsiburada.com/bade-natural-dogal-50-spf-yuksek-korumali-cocuk-gunes-koruyucu-losyon-mineral-filtreli-100-ml-pm-HBC00008THWPW
Gunes Bakim,"The Purest Solutions, Leke Karşıtı ve Cilt Tonu Eşitleyici Renkli Güneş Koruyucu Krem SPF 50, 50 ml",The,429.9,4.5,7159,https://www.hepsiburada.com/the-purest-solutions-lekeli-ciltler-icin-antioksidan-destekli-gunes-kremi-50-spf-uva-uvb-blemish-defense-antioxidant-protection-tps209-pm-HBC0000299O8F
Gunes Bakim,"Bioderma Photoderm Pediatrics Lait SPF50+ Bebek, Çocuk Çok Yüksek Korumalı Süt Formda Güneş Kremi 100 ml",Bioderma,699.0,4.5,33,https://www.hepsiburada.com/photoderm-pediatrics-lait-spf50-bebek-cocuk-cok-yuksek-korumali-sut-formda-gunes-kremi-100-ml-pm-HBC00008Z6PTQ
Gunes Bakim,La Roche-Posay Anthelios Uvmune 400 SPF50+ Yağ Kontrol Kremi 50 ml x2 Yağlı Hassas Ciltler İçin,La,2299.8,4.6,1227,https://www.hepsiburada.com/antehlios-uvmune-400-spf50-oil-control-gunes-kremi-50-mlx2-yagli-hassas-ciltler-icin-pm-HBC0000233M9S
Gunes Bakim,Solante Pigmenta Lotion Spf 50+ 150 ml,Solante,1160.0,4.4,6252,https://www.hepsiburada.com/solante-pigmenta-lotion-spf-50-150-ml-pm-HBC0000087XY8
Gunes Bakim,Bioderma Photoderm AR Yüksek Korumalı Renkli Yüz Güneş Kremi SPF50+ Hassas Ciltler İçin 30 ml,Bioderma,861.47,4.6,681,https://www.hepsiburada.com/photoderm-ar-spf50-yuksek-korumali-renkli-yuz-gunes-kremi-30-ml-pm-HBC00001WTLV0
Gunes Bakim,Siveno %100 Doğal ve Organik Tamanu Yağlı Güneş Losyonu Mineral Filtreli Tüm Aile İçin SPF 50+ UVA UVB 100 ml,Siveno,1555.33,4.6,650,https://www.hepsiburada.com/siveno-100-dogal-ve-organik-tamanu-yagli-gunes-losyonu-mineral-filtreli-tum-aile-icin-spf-50-100-ml-pm-HBC00004QG4X2
Gunes Bakim,Sinoz  Pink Touch Anında Ton Eşitleyici Onarıcı Nemlendirici Pembe Yüz Güneş Kremi Spf50,Sinoz,1099.0,4.5,190,https://www.hepsiburada.com/sinoz-pink-touch-aninda-ton-esitleyici-onarici-nemlendirici-pembe-yuz-gunes-kremi-spf50-pm-HBC00006UQQ3B
Gunes Bakim,La Roche-Posay  Anthelios Uvmune 400 Oil Control Spf50+ Güneş Kremi 50 ml- Karma ve Yağlı Ciltler İçin,La,1020.99,4.6,7720,https://www.hepsiburada.com/-anthelios-uvmune-400-oil-control-spf50-gunes-kremi-50-ml-karma-ve-yagli-ciltler-icin-pm-HB000004TZ83
Gunes Bakim,Bade Natural %100 Mineral Filtreli ve Doğal 50 SPF Güneş Koruyucu Stick Yaşlanma Karşıtı ve Besleyici 6g,Bade,359.9,4.0,411,https://www.hepsiburada.com/bade-natural-50-spf-gunes-koruyucu-stick-6-g-pm-HBC00004HV7QO
Gunes Bakim,"Bioderma Photoderm Aquafluide Invisible Güneş Kremi SPF50+ - Hassas Ciltler İçin Matlaştırıcı ve Geniş Spektrum Koruma, 40 ml",Bioderma,760.0,4.4,1762,https://www.hepsiburada.com/bioderma-photoderm-aquafluide-invisible-gunes-kremi-spf50-hassas-ciltler-icin-matlastirici-ve-genis-spektrum-koruma-40-ml-pm-HBC00003WFJWJ
Gunes Bakim,Sebamed Sun Care 50 SPF Hassas Ciltler İçin Çok Yönlü Güneş Kremi 75 ml Paraben İçermeyen,Sebamed,649.9,4.4,5769,https://www.hepsiburada.com/sun-care-uva-uvb-filtresi-ve-e-vitamini-uclu-yuksek-koruma-cok-yonlu-gunes-kremi-50-spf-75-ml-pm-sgsebamed0378475
Gunes Bakim,EKS Ticaret Bioderma Photoderm Spot Spf 50+ Leke Karşıtı Güneş Kremi 150 ml,EKS,559.0,4.2,19,https://www.hepsiburada.com/bioderma-photoderm-spot-spf-50-leke-karsiti-gunes-kremi-150-ml-pm-HBC00004924UK
Gunes Bakim,Holika Holika Aloe Soothing Essence Waterproof Sun Cream SPF50+ - Aloe Yatıştırıcı Özlü Güneş Kremi,Holika,749.0,4.8,397,https://www.hepsiburada.com/holika-holika-aloe-soothing-essence-waterproof-sun-cream-spf50-aloe-yatistirici-ozlu-gunes-kremi-pm-HBC00003GRKOW
Gunes Bakim,Garnier C Vitamini Parlak Günlük Güneş Koruyucu Fluid Yüz Kremi Işıltılı Doku SPF50+ 40ML,Garnier,339.9,4.3,709,https://www.hepsiburada.com/garnier-c-vitamini-parlak-gunluk-gunes-koruyucu-fluid-yuz-kremi-isiltili-doku-spf50-40ml-pm-HBC00005XH5OX
Gunes Bakim,La Roche-Posay Antehlios Uvmune 400 Spf50+ Renkli Güneş Kremi 50 ml- Tüm Cilt Tipleri İçin,La,589.0,4.2,2089,https://www.hepsiburada.com/antehlios-uvmune-400-spf50-renkli-gunes-kremi-50-ml-tum-cilt-tipleri-icin-pm-HBC00001HEO31
Gunes Bakim,Garnier C Vitamini Parlak Günlük Güneş Koruyucu Fluid Yüz Kremi Görünmez Doku SPF50+ 40ML,Garnier,339.9,4.4,318,https://www.hepsiburada.com/garnier-c-vitamini-parlak-gunluk-gunes-koruyucu-fluid-yuz-kremi-gorunmez-doku-spf50-40ml-pm-HBC00005XA2WH
Gunes Bakim,Solante Pregna Spf 50+ 150 ml  Gebelik Dönemi Için Özel Güneş Koruma Kremi,Solante,1399.9,4.5,661,https://www.hepsiburada.com/solante-pregna-spf-50-150-ml-gebelik-donemi-icin-ozel-gunes-koruma-kremi-pm-HBC00003VAS82
Gunes Bakim,"The Purest Solutions, Yağlı ve Karma Ciltler İçin Matlaştırıcı Güneş Koruyucu Krem SPF 50, 50 ml",The,379.0,4.5,1336,https://www.hepsiburada.com/the-purest-solutions-yagli-ciltler-icin-mat-bitisli-gunes-kremi-50-spf-dry-touch-protection-mattifier-oil-control-moisturizer-tps210-pm-HBC0000299ODH
Gunes Bakim,Siveno %100 Doğal Yüz Güneş Kremi Renkli Ton Eşitleyici Leke Karşıtı SPF 50+ UVA UVB 30 ml,Siveno,559.9,4.5,103,https://www.hepsiburada.com/siveno-100-dogal-yuz-gunes-kremi-renkli-ton-esitleyici-leke-karsiti-uva-uvb-spf-50-30-ml-pm-HBC000095UXPM
Gunes Bakim,Cream Co. SPF50 Pink Güneş Koruyucu Krem | Ton Eşitleyici Leke Karşıtı | Aydınlatıcı | 40 ml | Güneş Serumu,Cream,899.0,4.3,3,https://www.hepsiburada.com/spf50-pink-gunes-koruyucu-krem-ton-esitleyici-leke-karsiti-aydinlatici-40-ml-gunes-serumu-pm-HBC0000D6ODHF
Gunes Bakim,"Nivea Sun SPF 50+ Güneş Koruyucu Krem - Hassas Ciltler İçin Suya Dayanıklı ve Nemlendirici Özellikte, 200 ml",Nivea,517.12,4.4,7297,https://www.hepsiburada.com/nivea-sun-spf-50-gunes-koruyucu-krem-hassas-ciltler-icin-suya-dayanikli-ve-nemlendirici-ozellikte-200-ml-pm-sgnivea53668
Gunes Bakim,Resh Lab Daily Watery Sun Cream SPF50+ Pa++++ - Hassas Ciltler İçin Yüksek Korumalı Güneş Kremi 50 ml,Resh,639.9,4.6,67,https://www.hepsiburada.com/resh-lab-daily-watery-sun-cream-spf50-pa-hassas-ciltler-icin-yuksek-korumali-gunes-kremi-50-ml-pm-HBC00006F2AXZ
Gunes Bakim,Avene Ultra Fluid Yağlı Ciltler İçin Ultra Hafif Güneş Kremi SPF 50 50 ml Matlaştırıcı Etki,Avene,548.9,4.0,28,https://www.hepsiburada.com/avene-ultra-fluid-oil-control-spf50-gunes-kremi-20-gr-pm-HBC000084NUAB
Gunes Bakim,Avene SunsiMed KA SPF 50+ Aşırı Hassas Ciltler İçin Yüksek Koruma Sağlayan Güneş Kremi 80 ml,Avene,859.0,4.6,390,https://www.hepsiburada.com/avene-sunsimed-photo-aging-gunes-koruyucu-leke-kremi-80-ml-pm-HB00000683XA
Gunes Bakim,INCIA %100 Doğal ve Organik Tamanu Yağlı Güneş Losyonu Mineral Filtreli Tüm Aile Için 50 SPF 100 ml,INCIA,1439.8,4.4,260,https://www.hepsiburada.com/incia-100-dogal-ve-organik-tamanu-yagli-gunes-losyonu-mineral-filtreli-tum-aile-icin-50-spf-100-ml-pm-HBC00004UHJ25
Gunes Bakim,Bioxcin Sun Care Çok Yüksek Korumalı Yağlı Ciltler için Güneş Kremi Spf 50+ 50 ml,Bioxcin,355.0,4.4,840,https://www.hepsiburada.com/bioxcin-sun-care-cok-yuksek-korumali-yagli-ciltler-icin-gunes-kremi-50-ml-spf-50-pm-HBC000029LGYD
Gunes Bakim,Bade Natural 50 Spf  Mineral Filtreli ve Doğal Yüksek Korumalı Güneş Stick 16g,Bade,449.9,3.8,429,https://www.hepsiburada.com/bade-natural-50-spf-mineral-filtreli-ve-dogal-yuksek-koruma-gunes-stick-pm-HBC000068RHRV
Gunes Bakim,INCIA %100 Doğal Yüz Güneş Kremi Leke Karşıtı Mineral Filtreli Yüksek Koruma SPF50 UVA UVB 50 ml,INCIA,1439.8,4.4,357,https://www.hepsiburada.com/incia-100-dogal-yuz-gunes-kremi-leke-karsiti-mineral-filtreli-yuksek-koruma-spf50-uva-uvb-50-ml-pm-HB000014MM59
Gunes Bakim,Minela Care Antiaging Organik Mineral Filtreli Yüz Güneş Kremi Spf 50 70 gr PA++++,Minela,349.0,3.9,461,https://www.hepsiburada.com/minela-care-antiaging-organik-mineral-filtreli-yuz-gunes-kremi-spf-50-70-gr-pm-HBC00004BJM3F
Gunes Bakim,L'Oréal Paris 2'li Revitalift Clinical Vitamin C Uv Fluid Seti,L'Oréal,539.0,4.6,1606,https://www.hepsiburada.com/l-or-al-paris-2-li-revitalift-clinical-vitamin-c-uv-fluid-seti-pm-HBC00003YYPS7
Gunes Bakim,Nivea NIVEA Sun SPF 50+ Güneş Alerjisine Karşı Hassas  Güneş Kremi 200 ml Sprey;Çok Yüksek Güneş sı,Nivea,561.83,4.7,1874,https://www.hepsiburada.com/nivea-sun-spf-50-gunes-alerjisine-karsi-hassas-gunes-kremi-200-ml-sprey-cok-yuksek-gunes-si-pm-HB00000INHGK
Gunes Bakim,"Avene Intense Protect SPF 50+ Bebek, Çocuk ve Yetişkinler için Yüksek Korumalı Güneş Kremi 150 ml",Avene,1321.59,4.4,329,https://www.hepsiburada.com/avene-intense-protect-spf50-150-ml-pm-HBC00001S456P
Gunes Bakim,MISSHA Aydınlık Görünüm Sunan Güneş Koruyucu A'PIEU Pure Block Tone-Up Sun Base EX SPF50+/PA+++ 50ml,MISSHA,694.9,4.6,1197,https://www.hepsiburada.com/missha-aydinlik-gorunum-sunan-gunes-koruyucu-a-pieu-pure-block-tone-up-sun-base-ex-spf50-pa-50ml-pm-HB00000WBPDR
Gunes Bakim,Siveno %100 Doğal Bronzlaştırıcı Yağ Organik Avokado Yağı Nemlendirici Yoğun Bronzlaştırıcı 50 ml,Siveno,466.44,4.4,108,https://www.hepsiburada.com/siveno-100-dogal-bronzlastirici-yag-organik-avokado-yagi-nemlendirici-yogun-bronzlastirici-50-ml-pm-HBC00008MXQ93
Gunes Bakim,La Roche-Posay La Roche Posay Anthelios Uvmune SPF50+ Yüz ve Vücut Güneş Sütü Normal Ciltler İçin Nemlendirici 150 ml,La,900.0,4.4,9,https://www.hepsiburada.com/la-roche-posay-face-body-yuz-vucut-gunes-kremi-spf-50-150-ml-pm-HBC000092PZA0
Gunes Bakim,Siveno %100 Doğal Çocuk Güneş Losyonu Leke Karşıtı Antioksidan Nemlendirici Bitkisel Vegan SPF 50+ UVA UVB 100 ml,Siveno,783.99,4.4,928,https://www.hepsiburada.com/siveno-100-dogal-cocuk-gunes-losyonu-leke-karsiti-antioksidan-nemlendirici-bitkisel-vegan-uva-uvb-spf-50-100-ml-pm-HBC0000C4O1HB
Gunes Bakim,"Nivea NIVEA Sun SPF50+ Güneş Koruyucu & 48 Nemlendirici Güneş Losyonu 200 ml,Çok Yüksek Güneş Koruması",Nivea,861.0,4.6,1127,https://www.hepsiburada.com/nivea-sun-spf50-gunes-koruyucu-48-nemlendirici-gunes-losyonu-200-ml-cok-yuksek-gunes-korumasi-pm-sgnivea53248
Gunes Bakim,La Roche-Posay Anthelios Family Vücut Güneş Spreyi SPF 50+ Tüm Cilt Tipleri İçin Hassas Koruma,La,2399.88,4.7,86,https://www.hepsiburada.com/la-roche-posay-anthelios-family-spray-spf50-300-ml-pm-HBC00003W366P
Gunes Bakim,Avene Renkli Güneş Kremi 50 ml SPF50+ Kuru Ciltler İçin Hafif Dokulu Yüz Koruyucu,Avene,382.99,4.5,367,https://www.hepsiburada.com/avene-tinted-fluide-renkli-gunes-kremi-spf50-50-ml-pm-HB00000BE594
Gunes Bakim,La Roche-Posay Anthelios Uvmune 400 Oil Control Gel Spf 50+ Renkli Güneş Kremi 50 ml-Yağlı/Hassas Ciltler İçin,La,842.1,4.5,1441,https://www.hepsiburada.com/anthelios-uvmune-400-oil-control-gel-spf-50-renkli-gunes-kremi-50-ml-yagli-hassas-ciltler-icin-pm-sgrct10002117
Gunes Bakim,Bade Natural Güneş Koruyucu Süt 50 SPF Tüm Cilt Tipleri İçin 30 ml,Bade,399.9,4.4,50,https://www.hepsiburada.com/bade-natural-gunes-koruyucu-sut-50-spf-tum-cilt-tipleri-icin-30-ml-pm-HBC00008XYLAR
Gunes Bakim,Bade Natural Aloe Vera Jel %100 Doğal 100 ml,Bade,399.9,4.6,260,https://www.hepsiburada.com/bade-natural-gunes-sonrasi-urun-pm-HBC000007KMR6
Gunes Bakim,New Well yüksek Koruma Etkili SPF50+ Pembe Yüz Güneş Kremi 50 ml,New,190.0,4.3,1703,https://www.hepsiburada.com/new-well-yuksek-koruma-etkili-spf50-pembe-yuz-gunes-kremi-50-ml-pm-HBC00004H1DVC
Gunes Bakim,Bioderma Photoderm AKN Mat SPF30 Güneş Kremi Karma Ciltler İçin 40 ml Yağsız Formül,Bioderma,685.0,4.6,417,https://www.hepsiburada.com/bioderma-photoderm-akn-mat-spf30-gunes-kremi-karma-ciltler-icin-40-ml-yagsiz-formul-pm-HBC0000251MD6
Gunes Bakim,Cosmed Hassas ve Kızarıklığa Eğilimli Ciltler için SPF50+ Yatıştırıcı Güneş Kremi /SUN ESSENTIAL ULTRASENSE CREAM GEL SPF50+  40 ml,Cosmed,837.46,4.5,214,https://www.hepsiburada.com/cosmed-sun-essential-ultrasense-spf-50-krem-jel-hassas-ciltler-icin-uva-uvb-ve-mavi-isik-korumasi-sunan-gunes-bakim-urunu-pm-HBC00002DAFLJ
Gunes Bakim,Cream Co. SPF50 Güneş Koruyucu Krem | Leke Karşıtı Nemlendirici Aydınlatıcı | 40 ml | Güneş Serumu,Cream,899.0,4.5,4,https://www.hepsiburada.com/spf50-gunes-koruyucu-krem-leke-karsiti-nemlendirici-aydinlatici-40-ml-gunes-serumu-pm-HBC0000D6NWNC
Gunes Bakim,Sinoz Spf 50 Leke Karşıtı Yüksek Koruyucu Yüz Güneş Kremi 50 ml Normal Ve Kuru Ciltler Için,Sinoz,799.0,4.5,2687,https://www.hepsiburada.com/sinoz-spf-50-leke-karsiti-yuksek-koruyucu-yuz-gunes-kremi-50-ml-normal-ve-kuru-ciltler-icin-pm-HB00000JBO50
