Kategori,Urun Adi,Marka,Fiyat (TL),Puan,Yorum Sayisi,Link
Makyaj,Maybelline New York Super Lock Brow Glue Kaş Sabitleyici Maskara - Şeffaf,Maybelline,329.9,4.1,1695,https://www.hepsiburada.com/maybelline-new-york-super-lock-brow-glue-kas-sabitleyici-maskara-seffaf-pm-HBC000068O5VC
Makyaj,Note Cosmetics 3 in 1 Healthy Skin Tinted Moisturizer SPF 50 Renk Ton Eşitleyici Krem - 10 Medium,Note,385.0,4.5,3768,https://www.hepsiburada.com/3-in-1-healthy-skin-tinted-moisturizer-spf-50-renk-ton-esitleyici-aydinlatici-krem-10-medium-pm-HBC00008V2Z30
Makyaj,L'Oréal Paris Telescopic Siyah Uzun Görünüm Veren Maskara,L'Oréal,309.0,4.3,13262,https://www.hepsiburada.com/telescopic-siyah-uzun-gorunum-veren-maskara-pm-HB0000043M2J
Makyaj,L'Oréal Paris L'oréal Paris Infaillible 24H Brow Lamination Şeffaf Kaş Sabitleyici,L'Oréal,669.0,4.5,306,https://www.hepsiburada.com/l-or-al-paris-infaillible-24h-brow-lamination-seffaf-kas-sabitleyici-pm-HBC000068O6RH
Makyaj,Maybelline New York Lash Sensational Yelpaze Etkili Intense Black Maskara - Ekstra Siyah,Maybelline,319.9,4.1,9639,https://www.hepsiburada.com/lash-sensational-yelpaze-etkili-intense-black-maskara-ekstra-siyah-pm-HB000005DG7D
Makyaj,Note Cosmetics 3 in 1 Glowing Skin Tinted Moisturizer SPF 50 Işıltılı Aydınlatıcı Krem,Note,579.9,4.3,496,https://www.hepsiburada.com/3-in-1-glowing-skin-tinted-moisturizer-spf-50-isiltili-aydinlatici-krem-pm-HBC00006G2A6O
Makyaj,Skin Sensual Magic Eye Duo Repair & CC - Çift Etkili Onarıcı ile Aydınlatıcı Göz Altı Kremi | Light To Medium 15ML,Skin,554.0,4.1,182,https://www.hepsiburada.com/magic-eye-duo-repair-cc-cift-etkili-onarici-ile-kapatici-goz-alti-kremi-light-to-medium-15ml-pm-HBC00009ZP27U
Makyaj,Note Cosmetics Silk Stay Lipliner Suya Dayanıklı Ipeksi Dudak Kalemi - 05 Roselle - Pembe,Note,449.9,4.8,18,https://www.hepsiburada.com/note-cosmetics-silk-stay-lipliner-suya-dayanikli-ipeksi-dudak-kalemi-01-muted-peach-nude-pm-HBC0000AQQD9X
Makyaj,L'Oréal Paris Lumi Blush Likit Allık - 630 Glowy True Rose,L'Oréal,339.9,4.4,183,https://www.hepsiburada.com/l-or-al-paris-lumi-blush-likit-allik-glowy-true-rose-pm-HBC00007HA3P1
Makyaj,TTO Clinic 24’lü Makyaj Temizleme Mendili – Nemlendirici & Arındırıcı Yüz Temizleme,TTO,435.6,4.2,11,https://www.hepsiburada.com/tto-makyaj-temizleme-mendili-24-lu-pm-HBC00005L20K5
Makyaj,L'Oréal Paris L'oréal Paris Telescopic Extensionist Maskara Hacim Verici Özellikleriyle Siyah Renk Büyük Boy,L'Oréal,749.95,4.5,86,https://www.hepsiburada.com/l-or-al-paris-telescopic-extensionist-maskara-pm-HBC0000C1ZH5V
Makyaj,Note Cosmetics 3 in 1 Healthy Skin Light Tinted Moisturizer SPF 50 Renk Ton Eşitleyici Aydınlatıcı Krem 00 Açık Ton,Note,579.9,4.0,194,https://www.hepsiburada.com/3-in-1-healthy-skin-light-tinted-moisturizer-spf-50-renk-ton-esitleyici-aydinlatici-krem-00-acik-ton-pm-HBC00006FIDCW
Makyaj,L'Oréal Paris Panorama Hacim Veren Maskara Siyah,L'Oréal,329.9,4.2,2250,https://www.hepsiburada.com/panorama-hacim-veren-maskara-siyah-pm-HBC00005JJG5C
Makyaj,"Skin Sensual BB Krem Light 50ml SPF50 PA++++ | Leke Karşıtı, Aydınlık Cilt Görünümü | UVA/UVB Koruma",Skin,440.0,4.3,1435,https://www.hepsiburada.com/skin-sensual-bb-krem-light-50-spf-uva-uvb-pa-pm-HBC0000604A9M
Makyaj,NYX Professional Makeup Bare With Me Kapatıcı Serum 02 Light Concealer,NYX,380.0,4.6,1644,https://www.hepsiburada.com/nyx-professional-makeup-bare-with-me-kapatici-serum-02-light-concealer-p-HBCV00004733T4
Makyaj,"Maybelline New York Lasting Drama Kahverengi Jel Göz Kalemi – Otomatik, Yumuşak Uçlu, 36 Saat Kalıcı ve Suya Dayanıklı",Maybelline,219.95,4.7,247,https://www.hepsiburada.com/maybelline-new-york-lasting-drama-kahverengi-jel-goz-kalemi-otomatik-yumusak-uclu-36-saat-kalici-ve-suya-dayanikli-pm-HBC00005XISJ2
Makyaj,Lancome Teint Idole Ultra Wear Care & Glow Serum Concelear Kapatıcı 115c,Lancome,2500.0,4.4,237,https://www.hepsiburada.com/lancome-teint-idole-ultra-wear-care-glow-serum-concelear-kapatici-115c-p-HBCV00005C8OEB
Makyaj,"Garnier Micellar Makyaj Temizleme Suyu 400ML, 24 Saat Nemlendirme, Hassas Ciltler için",Garnier,214.95,4.7,1775,https://www.hepsiburada.com/garnier-micellar-kusursuz-makyaj-temizleme-suyu-400-ml-pm-HB00000MKZDQ
Makyaj,Flormar Sheer Up Yarı Saydam Renk Veren Nemlendirici Stick Parlak Ruj (013 Gaia) 8682536012119,Flormar,389.99,4.6,342,https://www.hepsiburada.com/flormar-kremsi-dokulu-parlak-gorunumlu-nemlendirici-stik-ruj-dogal-pembe-sheer-up-lipstick-009-baby-girl-8682536012072-pm-HBC00004Z6W3A
Makyaj,L'Oréal Paris Glotion All-In-One Doğal Işıltı 902 - Light Glow,L'Oréal,549.9,4.4,795,https://www.hepsiburada.com/glotion-all-in-one-dogal-isilti-902-fair-glow-40-ml-highlighter-likit-aydinlatici-pm-HBC000068HGHW
Makyaj,Flormar Sheer Up Yarı Saydam Renk Veren Nemlendirici Stick Parlak Ruj (003 Pinky Nude) 8682536012010,Flormar,389.99,4.7,391,https://www.hepsiburada.com/flormar-ruj-sheer-up-lipstick-003-pink-nude-8682536012010-33000117-pm-HBC00000NOY7Y
Makyaj,"L'Oréal Paris Glotion All-in-one Doğal Işıltı 901 - Fair Glow 40 ml Highlighter, Likit Aydınlatıcı",L'Oréal,399.9,4.4,803,https://www.hepsiburada.com/glotion-all-in-one-dogal-isilti-901-fair-glow-40-ml-highlighter-likit-aydinlatici-pm-HBC000068HFGT
Makyaj,Garnier Micellar Kusursuz Makyaj Temizleme Suyu 100ML,Garnier,119.94,4.6,328,https://www.hepsiburada.com/garnier-micellar-kusursuz-makyaj-temizleme-suyu-100ml-pm-HBC000054TDSQ
Makyaj,"Garnier Mükemmel Makyaj Temizleme Suyu - Tüm Cilt Tiplerine Uygun Hassas Formül, Etkili Arındırma, 200 ml",Garnier,139.95,4.7,982,https://www.hepsiburada.com/garnier-mukemmel-makyaj-temizleme-suyu-tum-cilt-tiplerine-uygun-hassas-formul-etkili-arindirma-200-ml-pm-HBC00000CHPRO
Makyaj,Maybelline New York Instant Anti Age Eraser Kapatıcı - 01 Light,Maybelline,319.9,4.3,16465,https://www.hepsiburada.com/maybelline-new-york-instant-anti-age-eraser-kapatici-01-light-p-HBV000003MOE3
Makyaj,NYX Professional Makeup Bare With Me Kapatıcı Serum 01 Fair Concealer,NYX,364.99,4.5,630,https://www.hepsiburada.com/nyx-professional-makeup-bare-with-me-kapatici-serum-01-fair-concealer-pm-HBC00001WLA2Y
Makyaj,Flormar Volume Up Mascara Yoğun Hacim ve Lifting Etkili Kat Kat Uygulanabilir Maskara (000 Black) 8682536100724,Flormar,549.99,4.4,83,https://www.hepsiburada.com/volume-up-mascara-yogun-hacim-ve-lifting-etkili-kat-kat-uygulanabilir-maskara-pm-HBC00009VZ6PL
Makyaj,L'Oréal Paris Infaillible Tüm Yüze Uygulanabilir Kapatıcı 322 Ivory Concealer,L'Oréal,729.95,4.5,2651,https://www.hepsiburada.com/infaillible-tum-yuze-uygulanabilir-kapatici-322-ivory-concealer-p-HBV00000JA9GC
Makyaj,"Kremi BB Krem SPF 50+ | Nemlendirici, Kapatıcı | UVA/UVB Koruma | Ton Eşitleyici, Aydınlatıcı | 50 ml",Kremi,311.9,4.3,76,https://www.hepsiburada.com/kremi-bb-krem-spf-50-nemlendirici-kapatici-uva-uvb-koruma-ton-esitleyici-aydinlatici-50-ml-p-HBCV00009VTDE1
Makyaj,Kremi Kalıcı Dudak Kalemi | Uzun Süre Dayanıklı | Transfer Yapmaz | Doğal ve Hafif | Kolay Keskin Uygulama,Kremi,299.9,3.8,86,https://www.hepsiburada.com/kremi-kalici-dudak-kalemi-uzun-sure-dayanikli-transfer-yapmaz-dogal-ve-hafif-kolay-keskin-uygulama-p-HBCV0000CG4HT2
Makyaj,Flormar Stay Perfect Yüksek Pigmentli & Yarı Mat Bitişli Likit Kapatıcı (002 Light) 8682536085465,Flormar,484.99,4.5,1204,https://www.hepsiburada.com/stay-perfect-yuksek-pigmentli-yari-mat-bitisli-likit-kapatici-002-light-8682536085465-p-HBCV00005ZL8Q3
Makyaj,Flormar Longer Than Ever Uzun Görünüm Veren Maskara (001) 8682536067119,Flormar,549.99,4.6,779,https://www.hepsiburada.com/flormar-longer-than-ever-uzun-gorunum-veren-maskara-8682536067119-pm-HBC00005NP3GI
Makyaj,"Skin Sensual BB Krem Medium 50ml SPF50 PA++++ | Leke Karşıtı, Aydınlık Cilt Görünümü | UVA/UVB Koruma",Skin,490.0,4.4,675,https://www.hepsiburada.com/skin-sensual-bb-krem-medium-50-spf-uva-uvb-pa-aydinlik-ve-canlilik-pm-HBC0000604A9O
Makyaj,MISSHA Mükemmel Kapatıcılık Sunan Çok Fonksiyonlu BB MISSHA M Perfect Cover BB Cream Ex SPF42PA+++ No.21 20ml,MISSHA,424.9,4.4,485,https://www.hepsiburada.com/missha-mukemmel-kapaticilik-sunan-cok-fonksiyonlu-m-perfect-cover-bb-cream-ex-spf42-pa-no-21-20ml-pm-sgmisslivat529
Makyaj,L'Oréal Paris L'oréal Paris Infaillible Face Sculpter Stick Kontür - Light,L'Oréal,427.46,4.8,4,https://www.hepsiburada.com/l-or-al-paris-infaillible-face-sculpter-stick-kontur-light-pm-HBC0000AD3VYF
Makyaj,Maybelline New York Serum Etkili Hyalüronik Asit ve Besleyici Yağ Içeren Ruj - 106 Maybe It's Soft,Maybelline,524.95,4.2,37,https://www.hepsiburada.com/maybelline-new-york-serum-etkili-hyaluronik-asit-ve-besleyici-yag-iceren-ruj-106-maybe-it-s-soft-pm-HBC0000BESGSV
Makyaj,"Pop Beauty Kaş Sabitleyici ve Şekillendirici, Kaş Fırçası, Tarağı ve Sabitleyici Jel (Laminasyon Etkili)",Pop,479.99,4.4,550,https://www.hepsiburada.com/pop-beauty-kas-sabitleyici-ve-sekillendirici-kas-fircasi-taragi-ve-sabitleyici-jel-laminasyon-etkili-pm-HBC00004LHRFQ
Makyaj,"Bioderma Sensibio H2O Makyaj Temizleme Suyu - Hassas Ciltler için Yatıştırıcı ve Dengeleyici Etki, 500 ml",Bioderma,1059.0,4.7,3494,https://www.hepsiburada.com/bioderma-sensibio-h2o-makyaj-temizleme-suyu-hassas-ciltler-icin-yatistirici-ve-dengeleyici-etki-500-ml-pm-sglila4700
Makyaj,Maybelline New York Lash Sensational Body Maskara - Hacimli ve Gün Boyu Kalkık Görünen Kirpikler,Maybelline,699.9,4.2,193,https://www.hepsiburada.com/maybelline-new-york-lash-sensational-body-maskara-hacimli-ve-gun-boyu-kalkik-gorunen-kirpikler-pm-HBC0000BES59K
Makyaj,Flormar Gel Look Jel Görünüm Veren Koruyucu Son Kat Tırnak Cilası 8682536059275,Flormar,175.0,4.6,221,https://www.hepsiburada.com/flormar-gel-look-jel-gorunum-veren-koruyucu-son-kat-tirnak-cilasi-8682536059275-pm-HBC00004TEI1Z
Makyaj,"Alix Avien Gazsız Makyaj Sabitleyici Sprey 75 ml – Nemlendirici Formül, SPF İçermez, Her Cilt Tipine Uygun",Alix,349.9,4.1,97,https://www.hepsiburada.com/alix-avien-gazsiz-makyaj-sabitleyici-sprey-75-ml-nemlendirici-formul-spf-icermez-her-cilt-tipine-uygun-pm-HBC00007LTUM0
Makyaj,L'Oréal Paris Lumi Blush Likit Allık - 635 Glowy Worth It Medium,L'Oréal,499.95,4.5,105,https://www.hepsiburada.com/l-or-al-paris-lumi-blush-likit-allik-glowy-worth-it-medium-pm-HBC00007HA4L2
Makyaj,L'Oréal Paris Infaillible Tüm Yüze Uygulanabilir Kapatıcı 327 Cashmere Concealer,L'Oréal,650.0,4.5,2651,https://www.hepsiburada.com/infaillible-tum-yuze-uygulanabilir-kapatici-327-cashmere-concealer-p-HBV00000JA9GE
Makyaj,Lancome Lancôme İdole Favoriler Seti 7829999999195,Lancome,3499.0,4.5,38,https://www.hepsiburada.com/lanc-me-idole-favoriler-seti-7829999999195-pm-HBC00007GGLB1
Makyaj,Flormar Extreme Tattoo Yoğun Renk Veren Suya Dayanıklı Jel Göz Kalemi (005 Very Berry) 8682536028875,Flormar,199.0,4.5,1114,https://www.hepsiburada.com/flormar-kalici-jel-dokulu-suya-dayanikli-goz-kalemi-koyu-mor-extreme-tattoo-gel-pencil-005-very-berry-8682536028875-pm-HBC00000K7FEF
Makyaj,Maybelline New York Lash Sensational Sky High Burgundy Haze Maskara - Mürdüm,Maybelline,849.95,4.2,576,https://www.hepsiburada.com/maybelline-new-york-lash-sensational-sky-high-burgundy-haze-maskara-murdum-pm-HBC00006SHS2E
Makyaj,Kiko Milano Ruj - Unlımıted Double Touch - 103 Natural Rose - Uzun Süre Kalıcı Parlak / Mat Likit Lipstick,Kiko,999.0,4.2,1183,https://www.hepsiburada.com/kiko-milano-ruj-unlimited-double-touch-103-natural-rose-uzun-sure-kalici-parlak-mat-likit-lipstick-pm-HB0000146Z67
Makyaj,Mac Yumuşak Uçlu Göz Kalemi - Eye Kohl - Costa Riche 1.36 G,Mac,1449.0,4.5,269,https://www.hepsiburada.com/mac-yumusak-uclu-goz-kalemi-eye-kohl-costa-riche-1-36-g-p-HBCV00004K3SS1
Makyaj,Note Cosmetics Suya Dayanıklı 02 Espresso Kahverengi İpeksi Jel Göz Kalemi 1.2 gr Uzun Süre Kalıcı,Note,399.9,4.8,32,https://www.hepsiburada.com/note-cosmetics-silk-tattoo-liner-suya-dayanikli-ipeksi-jel-goz-kalemi-01-midnight-siyah-mat-pm-HBC0000AQQDA3
Makyaj,Note Cosmetics Translucent Setting Powder Makyaj Sabitleyici Toz Pudra - Transparan,Note,649.9,4.6,242,https://www.hepsiburada.com/translucent-setting-powder-makyaj-sabitleyici-toz-pudra-transparan-pm-HBC00000IKNKD
Makyaj,Maybelline New York Lash Sensational Sky High Maskara - Siyah,Maybelline,329.9,4.0,9828,https://www.hepsiburada.com/lash-sensational-sky-high-maskara-siyah-pm-HB00001B1F32
Makyaj,Flormar Sheer Up Yarı Transparan & Parlak Bitişli Nemlendirici Ruj (018 Enchanted Kiss) 8682536097864,Flormar,389.99,4.6,287,https://www.hepsiburada.com/flormar-sheer-up-yari-transparan-parlak-bitisli-nemlendirici-ruj-018-enchanted-kiss-8682536097864-p-HBCV00008BCDC4
Makyaj,Maybelline New York Super Stay Matte Ink Unnude Likit Mat Ruj - 65 Seductress - Nude 5 ml,Maybelline,797.45,4.6,4302,https://www.hepsiburada.com/super-stay-matte-ink-unnude-likit-mat-ruj-65-seductress-nude-5-ml-p-HBV00000BR51F
Makyaj,L'Oréal Paris Panorama Hacim Veren Maskara Koyu Kahverengi,L'Oréal,989.95,4.2,352,https://www.hepsiburada.com/panorama-hacim-veren-maskara-koyu-kahverengi-pm-HBC0000604DIA
Makyaj,Note Cosmetics Mineral Concealer Spf 15 Yoğun Kapatıcı Metal Başlıklı Göz Altı Kapatıcısı - 201 Açık,Note,629.9,4.6,286,https://www.hepsiburada.com/mineral-concealer-spf-15-yogun-kapatici-metal-baslikli-goz-alti-kapaticisi-201-acik-pm-HBC00008AWYVL
Makyaj,Nutrabella Göz Makyaj Bandı Eyeliner Çekme Aparatı Kuyruklu Eyeliner Şablonu Far Taşma Önleyici Bant,Nutrabella,135.0,4.6,16,https://www.hepsiburada.com/goz-makyaj-bandi-eyeliner-cekme-aparati-kuyruklu-eyeliner-sablonu-far-tasma-onleyici-bant-pm-HBC0000CX69OL
Makyaj,Flormar Sheer Up Lip Crush 3'lü Makyaj Seti,Flormar,1169.99,4.7,80,https://www.hepsiburada.com/sheer-up-lip-crush-3-lu-makyaj-seti-pm-HBC00008ZF582
Makyaj,Flormar 245 Natural Renkli Suya Dayanıklı Mat Dudak Kalemi Uzun Süre Kalıcı Özellikte,Flormar,169.99,4.6,782,https://www.hepsiburada.com/flormar-245-natural-renkli-suya-dayanikli-mat-dudak-kalemi-uzun-sure-kalici-ozellikte-pm-HBC0000008GVG
Makyaj,Görkito Makyaj Süngeri - Bordo,Görkito,449.9,4.7,1468,https://www.hepsiburada.com/gorkito-makyaj-sungeri-bordo-pm-HBC00001X694D
Makyaj,Flormar Sheer Up Yarı Saydam Renk Veren Nemlendirici Stick Parlak Ruj (009 Baby Girl) 8682536012072,Flormar,389.99,4.7,276,https://www.hepsiburada.com/flormar-kremsi-dokulu-parlak-gorunumlu-nemlendirici-stik-ruj-dogal-pembe-sheer-up-lipstick-009-baby-girl-8682536012072-pm-HBC00004Z6W3Y
Makyaj,Flormar Kalıcı Jel Dokulu Suya Dayanıklı Göz Kalemi (Siyah) - Extreme Tattoo Gel Pencil - 006 Onyx - 8682536028882,Flormar,199.99,4.4,3766,https://www.hepsiburada.com/flormar-yumusak-uclu-ve-suya-dayanikli-extreme-tattoo-jel-goz-kalemi-006-siyah-8682536028844-pm-HBC00000K7FEN
Makyaj,Kiko Milano KIKO Makyaj Setleri - Flirt Alert Mini Kisses 3D Hydra Lip Gloss ile Ultra Parlak Renkler,Kiko,1499.0,4.7,7,https://www.hepsiburada.com/makyaj-setleri-flirt-alert-mini-kisses-maxi-shine-kit-3d-hydra-lip-gloss-pm-HBC0000DA2EHA
Makyaj,L'Oréal Paris L'oréal Paris Infaillible Face Sculpter Stick Kontür - Medium,L'Oréal,427.46,4.6,5,https://www.hepsiburada.com/l-or-al-paris-infaillible-face-sculpter-stick-kontur-medium-pm-HBC0000AD3XI6
Makyaj,"Kremi KISS'N BLUSH | Allık, Ruj, Göz Farı 3'ü 1 arada | Nemlendirici, Makyaj, Makeup | Stick | Seramid, Skualen, Vitamin E",Kremi,291.9,3.9,125,https://www.hepsiburada.com/kremi-kiss-n-blush-allik-ruj-goz-fari-3-u-1-arada-nemlendirici-makyaj-makeup-stick-seramid-skualen-vitamin-e-p-HBCV00009VSX3X
Makyaj,Olalab Cosmetics OlaLab Cilt Bakım Ve Makyaj Çantası Büyük Boy-xl,Olalab,589.5,4.7,1151,https://www.hepsiburada.com/olalab-cilt-bakim-ve-makyaj-cantasi-buyuk-boy-xl-pm-HBC000053E39D
Makyaj,L'Oréal Paris Lumi Blush 625 Glowy Gold Pink Likit Allık Yüksek Pigmentasyon ve Işıltılı Bitiş,L'Oréal,329.9,4.7,99,https://www.hepsiburada.com/l-or-al-paris-lumi-blush-likit-allik-glowy-gold-pink-pm-HBC00007HA3LZ
Makyaj,"Note Cosmetics Hassas Kalem Likit Eyeliner - Yoğun Siyah, 1 ml, Uzun Süre Kalıcı, Suya Dayanıklı,Keçe Uçlu",Note,449.9,4.3,297,https://www.hepsiburada.com/note-cosmetics-hassas-kalem-likit-eyeliner-yogun-siyah-1-ml-uzun-sure-kalici-suya-dayanikli-kece-uclu-pm-sgmabu32013
Makyaj,Maybelline New York Lash Sensational Yelpaze Etkili Suya Dayanıklı Siyah Waterproof Maskara,Maybelline,742.45,4.3,1850,https://www.hepsiburada.com/maybelline-new-york-lash-sensational-yelpaze-etkili-suya-dayanikli-siyah-waterproof-maskara-pm-HB000007EB0H
Makyaj,"Kremi Lip Balm 2'li Set | Nemlendirici, Besleyici, Onarıcı | Vitamin E, Peptit, Vitamin E",Kremi,449.9,4.4,57,https://www.hepsiburada.com/kremi-lip-balm-2-li-set-nemlendirici-besleyici-onarici-vitamin-e-peptit-vitamin-e-p-HBCV0000CGXCFD
Makyaj,Flormar-Yumuşak Uçlu ve Suya Dayanıklı Extreme Tattoo Jel Göz Kalemi (002 Koyu Kahve) 8682536028844,Flormar-Yumuşak,199.99,4.5,1889,https://www.hepsiburada.com/flormar-yumusak-uclu-ve-suya-dayanikli-extreme-tattoo-jel-goz-kalemi-002-koyu-kahve-8682536028844-pm-HBC00000K7FDL
Makyaj,Flormar Extreme Tattoo Yoğun Renk Veren Suya Dayanıklı Jel Göz Kalemi (001 Glitzy Brown) 8682536028837,Flormar,199.0,4.5,1289,https://www.hepsiburada.com/flormar-kalici-jel-dokulu-suya-dayanikli-goz-kalemi-isiltili-kahve-extreme-tattoo-gel-pencil-001-glitzy-brown-8682536028837-pm-HBC00000K7FCT
Makyaj,The Glitter Lab - Jel Formlu Parlak Glitter - Yougurt Galaxy ~10 gr,The,290.0,4.6,78,https://www.hepsiburada.com/yougurt-galaxy-pm-HBC00001T6Q20
Cilt Bakim,TTO-X Nemlendirici Yüz Temizleme Köpüğü 200 ml | Hyaluronik Asit & Günlük Cilt Temizleyici,TTO-X,389.0,4.3,106,https://www.hepsiburada.com/tto-nemlendirici-yuz-temizleme-kopugu-niacinamide-icerikli-tum-cilt-tipleri-icin-200-ml-pm-HBC00009K0TWT
Cilt Bakim,La Roche-Posay Cicaplast Baume B5 100 ml- Kuru ve Tahriş Olmuş Ciltler İçin Onarıcı Bakım Kremi,La,1550.9,4.3,2652,https://www.hepsiburada.com/la-roche-posay-cicaplast-baume-b5-100-ml-kuru-ve-tahris-olmus-ciltler-icin-onarici-bakim-kremi-pm-sgucil27409
Cilt Bakim,"Bioderma Atoderm Ultra Vücut Kremi - 500 ml, Kuru Ciltler İçin Besleyici ve Nemlendirici Formül, Gözenekleri Tıkamayan",Bioderma,1499.0,4.5,6893,https://www.hepsiburada.com/bioderma-atoderm-ultra-vucut-kremi-500-ml-kuru-ciltler-icin-besleyici-ve-nemlendirici-formul-gozenekleri-tikamayan-pm-HBC0000378DEC
Cilt Bakim,MjCare Mjcare Nose Pack - Siyah Nokta ve Gözenek Için Temizleyici Burun Bandı 10LU,MjCare,253.44,4.5,5099,https://www.hepsiburada.com/mjcare-nose-pack-siyah-nokta-ve-gozenek-icin-temizleyici-burun-bandi-10lu-pm-HBC000011RRPV
Cilt Bakim,La Roche-Posay Cicaplast Baume Nemlendirici 100 ml Toleriane Caring Wash Temizleyici 50 ml,La,1509.9,4.4,189,https://www.hepsiburada.com/cicaplast-baume-nemlendirici-100ml-toleriane-caring-wash-temizleyici-50ml-pm-HBC000058H321
Cilt Bakim,Bade Natural Nioli Uçucu Yağı %100 Saf 10 ml,Bade,279.9,4.6,742,https://www.hepsiburada.com/bade-natural-nioli-ucucu-yagi-10-ml-pm-HBC000046NLDV
Cilt Bakim,Cream Co. Su Bazlı Moisturizer Nemlendirici Yüz Kremi | Hyaluronik Asit | 50 ML | Tüm Cilt Tipleri,Cream,249.0,4.6,9683,https://www.hepsiburada.com/cream-co-moisturizer-su-bazli-nemlendirici-yuz-kremi-tum-cilt-tipleri-pm-HBC00002LC7MZ
Cilt Bakim,Urban Care Seaweed Citrus Nemlendirici ve Besleyici Vücut Losyonu 200 ml - Vegan,Urban,139.0,4.5,107,https://www.hepsiburada.com/urban-care-seaweed-citrus-nemlendirici-ve-besleyici-vucut-losyonu-200-ml-vegan-pm-HBC00003ZKR69
Cilt Bakim,"Bade Natural Hint Yağı 30 ml – %100 Saf Soğuk Sıkım, Kırışıklık Karşıtı, Besleyici ve Nemlendirici Unisex Cilt Bakım Yağı",Bade,329.9,4.6,350,https://www.hepsiburada.com/bade-natural-hint-yagi-30-ml-100-saf-soguk-sikim-kirisiklik-karsiti-besleyici-ve-nemlendirici-unisex-cilt-bakim-yagi-pm-HBC00004FCHM8
Cilt Bakim,"La Roche-Posay Effaclar Duo+M Nemlendirici Krem - Tüm Cilt Tipleri İçin Hafif Formül, 40 ml, Günlük Kullanım İçin İdeal",La,1000.0,4.6,2501,https://www.hepsiburada.com/la-roche-posay-effaclar-duo-m-nemlendirici-krem-tum-cilt-tipleri-icin-hafif-formul-40-ml-gunluk-kullanim-icin-ideal-pm-HBC0000519406
Cilt Bakim,Urban Care Turmeric Honey Vücut Peelingi 200 Ml-Vegan,Urban,159.0,4.0,106,https://www.hepsiburada.com/urban-care-turmeric-honey-vucut-peelingi-200-ml-vegan-pm-HBC00003ZOCF9
Cilt Bakim,La Roche-Posay Effaclar Yağlı Ciltler İçin Arındırıcı Temizleme Jeli 400 ml L'Oréal Türkiye Üretimi,La,1055.9,4.7,591,https://www.hepsiburada.com/effaclar-refill-yagli-ciltler-icin-temizleme-jeli-400ml-pm-HBC00005CCAE2
Cilt Bakim,Bade Natural Gül Suyu Etkili Tonik %100 DoğalSaf 100 ml,Bade,399.9,4.6,1473,https://www.hepsiburada.com/bade-natural-dogal-gul-suyu-100-ml-pm-HB00000GOVTX
Cilt Bakim,La Roche-Posay Cicaplast Baume B5+ Onarıcı ve Yatıştırıcı Bakım Krem 40 ml,La,836.89,4.4,4252,https://www.hepsiburada.com/la-roche-posay-cicaplast-baume-b5-onarici-bakim-kremi-40ml-pm-sgbe3337872412998
Cilt Bakim,Bioderma Sensibio Foaming Gel Hassas ve Normal Ciltler Durulanan Micellar Yüz Temizleme Jeli 500 ml,Bioderma,1249.0,4.2,4484,https://www.hepsiburada.com/sensibio-foaming-gel-hassas-ve-normal-ciltler-durulanan-micellar-yuz-temizleme-jeli-500-ml-pm-HBC00001VZNFQ
Cilt Bakim,TTO Thermal Nemlendiricili Tonik 120 ml Tüm Cilt Tipleri İçin Canlandırıcı Etki ve AHA İçerir,TTO,415.0,4.7,9,https://www.hepsiburada.com/thermal-nemlendiricili-tonik-pm-HBC0000B3NUMT
Cilt Bakim,Siveno %100 Doğal Dudak Koruyucu Çilek Bitkisel Lip Balm Dudak Kremi Nemlendirici Parlatıcı Onarıcı 6 G,Siveno,399.77,4.7,462,https://www.hepsiburada.com/siveno-100-dogal-dudak-koruyucu-cilek-bitkisel-lip-balm-dudak-kremi-nemlendirici-parlatici-onarici-6-g-pm-HBC000062XGMZ
Cilt Bakim,"Nivea NIVEA Vücut Losyonu Q10 + C Vitamini 250ml, 48 Saat Vücut Nemlendirme, 10 Günde Sıkılaşma, Normal Ciltler için, Vücut Bakım",Nivea,194.9,4.7,2786,https://www.hepsiburada.com/nivea-sikilastirici-vucut-losyonu-q10-c-vitamini-250ml-48-saat-vucut-nemlendirme-10-gunde-sikilasma-normal-ciltler-icin-vucut-bakim-pm-HBC000025MPAZ
Cilt Bakim,"The Purest Solutions, 24 Saat Etkili Günlük Yoğun Nemlendirici Cilt Bakım Kremi 50 ml",The,369.0,4.6,6524,https://www.hepsiburada.com/the-purest-solutions-24-saat-etkili-gunluk-yogun-nemlendirici-bakim-kremi-tps202-pm-HBC000014QVAP
Cilt Bakim,Bioderma Atoderm Cream Ultra Normal ve Kuru Ciltler için Nemlendirici Yüz ve Vücut Bakım Kremi 200 ml,Bioderma,737.9,4.7,6102,https://www.hepsiburada.com/atoderm-cream-ultra-normal-ve-kuru-ciltler-icin-nemlendirici-yuz-vucut-bakim-kremi-bebek-cocuk-ve-yetiskin-kullanimina-uygun-200-ml-pm-HBC0000374BSG
Cilt Bakim,Bioderma Sebium Foaming Gel Yağlı ve Akneli Ciltler için Arındırıcı Temizleme Jeli 500 ml,Bioderma,939.0,4.4,7720,https://www.hepsiburada.com/sebium-karma-yagli-ve-akne-egilimli-ciltler-sivilce-siyah-nokta-karsiti-yuz-temizleme-jeli-500-ml-pm-HB0000039DNY
Cilt Bakim,The Purest Solutions Canlandırıcı Tüm Ciltler için Glikolik Asit Tonik 200 ml,The,314.0,4.6,17505,https://www.hepsiburada.com/the-purest-solutions-tonik-200-ml-glycolic-acid-5-aha-bha-tps104-pm-HB0000119LGK
Cilt Bakim,La Roche-Posay Effaclar Yağlı Ve Akneye Eğilimli Ciltler İçin Yüz Temizleme Jeli 400 ml,La,914.26,4.5,14722,https://www.hepsiburada.com/la-roche-posay-effaclar-yuz-temizleme-jeli-400-ml-yagli-ve-akneye-egilimli-ciltler-icin-pm-sgonkozd14533
Cilt Bakim,The Purest Solutions C Vitamini Aydınlatıcı Ve Ton Eşitleyici Bakım Serumu 30 ml,The,324.0,4.6,21724,https://www.hepsiburada.com/the-purest-solutions-c-vit-aydinlatici-ve-ton-esitleyici-bakim-serumu-30-ml-10-ascorbic-acid-ferulic-acid-0-5-pm-HBC00000X9X3V
Cilt Bakim,Bade Natural Hint Yağı Soğuk Sıkım %100 Saf 100 ml,Bade,499.9,4.7,47,https://www.hepsiburada.com/bade-natural-hint-yagi-soguk-sikim-100-saf-100-ml-pm-HBC0000C4LI4N
Cilt Bakim,TTO Dermo Dicos Plus Krem 30 ml Nemlendirici Etkili Normal Ciltler İçin Dermatolojik Olarak Test Edilmiş,TTO,798.9,4.5,316,https://www.hepsiburada.com/tto-dermodicos-plus-krem-30-ml-pm-HBC00001WSU6L
Cilt Bakim,Skin401 Yatıştırıcı ve Leke Karşıtı %5 Azelaik Asit Serum 30ML Hassas Ciltler İçin Yenileyici Etki,Skin401,349.0,4.5,68,https://www.hepsiburada.com/skin401-skin401-5-azelaik-asit-serum-30ml-pm-HBC00005JKUEV
Cilt Bakim,"Garnier C Vitamini Fresh & Bright Aydınlatıcı Nemlendirici Sorbe Yüz Kremi 85 Ml, Vegan & Cruelty Free",Garnier,359.94,4.7,31,https://www.hepsiburada.com/garnier-c-vitamini-fresh-bright-aydinlatici-nemlendirici-sorbe-yuz-kremi-85-ml-vegan-cruelty-free-pm-HBC0000CQGPSQ
Cilt Bakim,"Clinique Moisture Surge™ 100 Saat Etkili Nemlendirici Yüz Kremi 30ml | Aloe Vera BioFerment, Hyalüronik Asit",Clinique,1275.0,4.7,2545,https://www.hepsiburada.com/clinique-moisture-surge-100-saat-etkili-nemlendirici-30-ml-192333066928-pm-HBC000003ADBR
Cilt Bakim,TTO Yüz Temizleme Köpüğü 200 ml – Çay Ağacı Yağlı Arındırıcı Cilt Temizleyici | Demodex’e Eğilimli Ciltler İçin,TTO,870.0,4.5,277,https://www.hepsiburada.com/tto-thermal-kopuk-solusyon-250-ml-pm-HB00000NH1V7
Cilt Bakim,La Roche-Posay Güneş Korumalı Cilt Bakım Seti : Effaclar Yüz Temizleme Jeli 400ml & Anthelios Yüz Güneş Kremi 15ml,La,1199.86,4.7,96,https://www.hepsiburada.com/la-roche-posay-cilt-bakim-seti-2-adet-tum-cilt-tipleri-icin-gunes-koruma-ve-derin-temizlik-niacinamide-pm-HBC00008CFC8R
Cilt Bakim,"Bioderma Atoderm Intensive Balm Çok Kuru Atopi Eğilimli Cilt Nemlendirici Krem Yetişkin, Çocuk 500 Ml",Bioderma,1566.21,4.5,3027,https://www.hepsiburada.com/atoderm-intensive-balm-cok-kuru-atopi-egilimli-cilt-nemlendirici-onarici-krem-yetiskin-cocuk-500-ml-pm-HB00000W00VI
Cilt Bakim,Urban Care Turmeric Honey Vücut Losyonu 200 Ml-Vegan,Urban,139.0,4.2,50,https://www.hepsiburada.com/urban-care-turmeric-honey-vucut-losyonu-200-ml-vegan-pm-HBC00003ZOCFB
